"craftsman_id","craftsman_name","craftsman_address","craftsman_birthday","craftsman_email","product_id","product_name","product_description","product_type","product_price"
1,Andre Hoggan,"9146 Prairie Rose Junction",1997-12-26,bburrett1@thetimes.co.uk,1,Handwash - Skin Care,"HandMade skincare liquid hand wash has been especially formulated for daily use. It fights the growth of germs and bacteria and leaves your hands feeling fresh and clean. It takes care of your hands while you clean off bacteria and germs with this skincare handwash.  For Beauty tips, tricks & more visitÂ https://bigbasket.blog/",Beauty & Hygiene,94
2,Hillery Duffrie,"45897 Jay Crossing",2004-08-02,edale2@indiatimes.com,2,HandMade Scarlet Glare LacquerInk Lip Shine 307,"Shade NameScarlet Glare 307What it isLacquerInk Lip Shine What it doesA featherweight lip shine where high-intensity pigment meets the luminosity of a glossThe unique blend of oils in this hybrid formula offers the shine and comfort of a glossThe smoothing polymers provide the durable, hydrating color of a lipstickGlossy oils provide a comfortable, non-sticky feel and a lacquer-like finishLiqui-ink technology uses a minimal amount of waxes to deposit intense pigment with the weightless glide of a glossUltra-fine pigments offer intense, full-coverage color that lastsThis product is dermatologist-tested.",clothes,128
3,Eddy Giamo,"42669 Grover Center",2002-08-28,mpallas3@symantec.com,3,Bathing Soap,"HandMade Soap is being used throughout the world for beneficial and softening the skin. This soap is finished from pure vegetable ingredients and contains Natural HandMadewood oil.  For Beauty tips, tricks & more visit https://bigbasket.blog/",Beauty & Hygiene,119
4,Jarad Hearnden,"91 Northport Circle",1997-07-21,gdu4@google.ru,4,HandMade Men Blue Slim Fit Solid Formal Shirt,"Blue solid formal shirt, has a spread collar, long sleeves, button placket, straight hem, and 1 patch pocket",clothes,113
5,Keelby Dmitriev,"65622 Prairieview Pass",1990-12-25,gbooton5@gnu.org,5,Cream Beauty Bathing Bar,"HandMade Cream Beauty Bar combines a gentle cleansing formula with HandMade’s signature ¼ moisturising cream to give you softer, smoother and more glowing skin. The mild cleansers help your skin to retain its natural moisture rather than stripping it away.  This HandMade bar even helps to replenish nutrients that are lost during the cleansing process – where a regular soap bar might leave your skin feeling dry and tight, a HandMade White Bar leaves it feeling soft and smooth. It’s not a soap – it’s a beauty bar. Washing with regular soap can cause the skin to feel dry, tight and irritated as some cleansing ingredients strip skin of essential nutrients. What makes HandMade different? Its gentle cleansers help your skin retain its natural moisture and its mild formula is kind to your skin. HandMade is the No.1 Brand recommended by dermatologists in India.  For best results, lather up your HandMade Beauty Bar and massage the smooth, creamy lather over your face and body before rinsing thoroughly. For soft, smooth hands, you can also enjoy regular hand-washing throughout the day with your HandMade bar. Soap may dry out your hands, but the classic moisturising formula of HandMade bars will leave skin softer, smoother and more glowing.",Beauty & Hygiene,228
6,Marion Delacourt,"066 Clove Plaza",2003-11-27,scicco6@twitter.com,6,HandMade Women Blue Solid Bomber Jacket,"Blue solid bomber jacket, has a mock collar, 2 pockets, zip closure, long sleeves, straight hem, and polyester lining",clothes,50
7,Inesita Gillyett,"552 Pennsylvania Plaza",2004-02-10,sgodfrey7@feedburner.com,7,Antiseptic- Disinfectant Liquid 550 ml + Clinical Strength Hand Sanitizer 500 ml,"Antiseptic - Disinfectant Liquid: HandMade Antiseptic Liquid protects you and your family from 100 illness-causing germs. It comes in a fresh pine fragrance. The topical antiseptic liquid sanitizes your home and helps maintain your personal hygiene.  It can be used to protect against infection from cuts and scratches, disinfect toys, and sanitize baby wear leaving everything clean and fresh. It can also be used as a household disinfectant and cleaner on surfaces or in laundry cleaning to kill germs. 
This liquid antiseptic is recommended by the Indian Medical Association and can be kept in your emergency first aid kit. *Protects from 100 illness-causing germs and Coronavirus causing COVID19 virus. Proven to be >99.9% effective at inactivating SARS-CoV-2, the virus that causes COVID19, when used at 1:40 dilutions with 5 minutes contact time; As per standard testing protocol. 
Clinical Strength Hand Sanitizer: Your Trusted HandMade offers a new and improved HandMade Clinical Strength Hand Sanitizer that kills 99.99% of germs without the use of soap and water. This broad-spectrum antimicrobial hand sanitizer is Bactericidal, Fungicidal & Virucidal. Enriched with emollients and humectants, HandMade’s Antiseptic Hand rub protects from various enveloped and non-enveloped bacteria and doesn’t let your hands dry up. It is an ideal hand disinfectant to protect medical personnel and patients while providing greater than 99.99% kill against many gram-positive and gram-negative bacteria. You can rely on HandMade sanitizer to protect yourself and your family from a wide range of illness-causing germs anytime, anywhere. Keeping germs at bay with HandMade’s hospital hand sanitizer is easy.",Beauty & Hygiene,174
8,Goldy Golda,"4 Nelson Junction",1990-01-26,kveevers8@gmpg.org,8,HandMade Men White Slim Fit Printed Casual Shirt,"White printed casual shirt, has a spread collar, long sleeves, button placket,  straight hem, one patch pocket",clothes,228
9,Amara Crafts,"6 Buhler Circle",1996-07-21,dmcturk9@tumblr.com,9,"Bathing Bar Soap - Germ Protection, Original","HandMade is one of the worlds most trusted antiseptic protection brand which gives you 99. 99% protection against disease causing bacteria, germs and es. Their body bathing bar is guaranteed to provide you 100% better freshness than the other ordinary bodywashes. It is refreshing and rejuvenating properties will brighten up your mornings and will leave you energised and smelling great.  | With nourishing moisturisers that make skin softer and smoother.  | Use as a part of personal hygiene for healthy skin everyday.  | Dermatologically tested to be safe on skin.  | Recommended by the Indian Medical Association.",Beauty & Hygiene,40
10,Buddy Hay,"952 Nelson Place",1999-07-05,glemerya@stanford.edu,10,HandMade Women Maroon Solid Pullover Sweatshirt,"Maroon solid pullover sweatshirt, has a hood, long sleeves, straight hem, applique detailing at the chest",clothes,280
11,Ernie Errowe,"0 Brickson Park Pass",1998-08-19,msommerlieb@patch.com,11,Germ Fighter Handwash Refill - Neem & Aloe Vera,"HandMade Germ Fighter is a handwash unlike any other. It washes the germs away with the goodness of Neem known to be tough on germs and soothing Aloe Vera is known for being gentle on skin, thus leaving your hands soft and your nose delighted. This product is 100% recyclable and 100% reusable. It is also available in a 1.5L refill pack.",Beauty & Hygiene,232
12,Zared Denning,"8 West Way",1997-06-16,gsalsburyc@samsung.com,12,HandMade Men Maroon Checked Regular-Fit Single-Breasted Formal Suit,"Maroon checked party suitMaroon checked slim-fit blazer, has a notched lapel, single-breasted with double-button closure, long sleeves, two flap pockets, one welt pocket, and a double-vented back hemA pair of maroon checked mid-rise trousers, has a waistband with belt loops, a zip fly with a button closure, two pockets.Blue solid waistcoat, has a V-neck, button closures on the front, sleeveless",clothes,295
13,Cherin Stammler,"1387 8th Parkway",1999-05-09,gmaccarlichd@telegraph.co.uk,13,Total 10 Soap Bar,"The HandMade Total Soap Bar offers complete germ protection for you and your family. It is Worlds No. 1 selling germ protection soap. It is powered with Activ SILVER, one of natures most powerful ingredients that helps fight infection-causing germs. So give your family 100% better germ protection with HandMade soap.



Bathe regularly, that is, wash your body often after intervals that suit you with HandMade soap with Activ silver which gives you protection from 10 infection causing germs. It has been proven that handwashing can help avoid numerous illnesses, it is one of the most effective ways of preventing you and your family form common illnesses, which are usually caused by invisible germs. These invisible germs on your hand enter your body while eating food and then may cause stomach infection. Using HandMade soap, to wash your hands every time before eating, helps remove these germs and hence stay protected from illnesses causing germs.



Buy HandMade Total Soap Bar in its pack of 4, now! It is available in 4 variants: Total 10, Care, Nature, Lemon fresh variants.



Also available in the following pack sizes: 125g single bar.

Also try HandMade Superfast HandWash which gives you 99.9% percent germ protection in just 10 seconds (as per lab test and on indicator organism).





Features and Bullet Points

• HandMade Total comes with power of Activ Silver

• Best ever protection from 10 infection causing germs

• Have clean, soft skin & a germ-free bathing experience with HandMade Total germ protection soap bar

• Worlds No. 1 selling germ protection soap

• Approved by Royal society of Public health

• Also available in Lemon Fresh, Care & Nature variant  For Beauty tips, tricks & more visitÂ https://bigbasket.blog/",Beauty & Hygiene,56
14,Kirby Balf,"2 Crest Line Avenue",2000-07-04,hstegglese@phoca.cz,14,HandMade Women White Sneakers,"A pair of round-toe white sneakers, has regular styling, lace-up detailSynthetic upperCushioned footbedTextured and patterned outsoleWarranty: Warranty: 3 months against manufacturing defects only (not valid on products under discount or promotional offer)Warranty provided by brand/manufacturer",clothes,291
15,Jaye Bockett,"6127 3rd Crossing",1994-09-15,clukef@theguardian.com,15,Sanitizer - Original Germ Protection,"HandMade is one of the world's most trusted antiseptic protection brand which gives you 99.99% protection against disease-causing bacteria and germs. Their hand sanitizer protects you from 100 illness-causing germs and saves you the trouble of washing your hands with soap and water during emergencies. HandMade Hand Sanitizer kills 99.9% of germs instantly, without water. Use anytime, anywhere: while in car, office, handbag, picnics, nappy change, travel, sports etc. Leaves your hands refreshed. Use as often as required. Germ protection in the classic HandMade fragrance.Rinse Free & Non-sticky.Use HandMade Hand Sanitiser to protect transference of germs from your hands anytime, anywhere without the use of soap or water.Recommended by the Indian Medical Association.",Beauty & Hygiene,283
16,Jarrod Reasce,"6 Brentwood Hill",2000-08-07,ilambdeng@psu.edu,16,HandMade Men IntelliSoft Antimicrobial Micro Modal Pack of 2 Illuminati Briefs XYBRF2PCKN281,"Pack of 2 briefs in Blue & Navy with contoured front pouch and anti-microbial finish that prevents odours and rashes.

Key Features:

Intellisoft: Our fabric technology makes for the softest, smoothest and comfiest innerwear ever, making you forget you are wearing anything at all. 
Feel: 3Xsofter and 50% more moisture absorbent than regular cotton.
Snug Fit:Fits your form without clinging to your skin and offers fantastic support.
Waistband:Anti-roll microfibre waistband that doesn't leave marks.
Skin Hygiene:Flat-lock seams are smooth on skin so there is no itching, chafing or irritation.",clothes,117
17,Job Salamon,"41 Magdeline Way",1995-09-24,lbrecknellh@cdbaby.com,17,Liquid Handwash - Original,"Your Trusted HandMade offers a new and improved HandMade original liquid handwash. It is specially formulated to protect you from 100 illness causing germs. It gives 10X better protection than any ordinary soap. 
You can also protect your family by using the following products:
• HandMade Bar Soap: Provides 100% better protection vs ordinary soaps. 
• HandMade Sanitizer: protect your hands from germs when you do not have access to water and HandMade Liquid Handwash 
• HandMade Wipes: Protects from a wide range of germs anytime, anywhere.  For Beauty tips, tricks & more visitÂ https://bigbasket.blog/",Beauty & Hygiene,196
18,Gibbie Ormrod,"0463 Meadow Vale Street",1998-11-20,vflatti@pen.io,18,HandMade Women Black & White Striped Heeled Sandals,"A pair of black & white open toe sandals, has regular styling, backstrap detailSynthetic upperCushioned footbedTextured and patterned outsole, has a block heelWarranty: Warranty: 3 months against manufacturing defects only (not valid on products under discount or promotional offer)Warranty provided by brand/manufacturer",clothes,222
19,Zed Giffin,"8 Dawn Place",1994-09-14,wvaudrej@deviantart.com,19,Hand Wash - Masterblaster,"Gentle on hands not so gentle on germs +naturally derived, +fight germs, +loves hands & no Triciosan.  For Beauty tips, tricks & more visitÃ‚ https://bigbasket.blog/",Beauty & Hygiene,272
20,Malinde Ornelas,"2165 Lighthouse Bay Street",1996-09-26,fmilhamk@dailymotion.com,20,HandMade Santa Cruz  Men Black Solid Slip-Ons,A pair of black solid flip flopsSynthetic upper materialCushioned footbedPatterned synthetic outsoleWarranty: 3 monthsWarranty provided by brand/manufacturer,clothes,274
21,Hazlett Bree,"6 Crownhardt Plaza",1991-09-02,wbrionl@umich.edu,21,Deodorant & Complexation Soap - Original,"HandMade Original Bath Soap protects you from exposure to sun, dust and pollution, and helps you prevent acne, blemishes and rashes. ... Its high TFM keeps your skin healthy and glowing as it leaves the skin soft, supple and acne-free. As the name suggests, it is a deodorant soap, therefore the smell is long-lasting and powerful enough to keep bad odour away. Moreover, the fragrance makes you feel fresh throughout the day. Unlike other soaps, HandMade's range of soaps are gentle on the skin and keeps it cleans.",Beauty & Hygiene,153
22,Paulie Trewin,"396 Carioca Point",1990-07-05,ksculpherm@wordpress.com,22,HandMade Men Blue Regular Fit Solid Formal Shirt,"Blue solid formal shirt, has a spread collar, long sleeves, button placket,  straight hem, one patch pocket",clothes,64
35,Nessa Coker,"83314 Transport Alley",1993-05-21,pplaunchz@squarespace.com,35,Ayurveda Clear Skin Soap,"HandMade Ayurveda Clear Skin Soap is specially made with Kanaka Taila, a traditional ayurvedic oil which is infused with carefully selected herbs like Yashtimadhu, Priyangu, Kamala, Manjistha, Nagakesara, Rakta Chandana and Tila Taila. This unique formulation nourishes, protects and improves skin complexion, leaving it healthy and clear, naturally.",Beauty & Hygiene,147
36,Joyan Twinbrow,"220 1st Plaza",2002-07-04,dfucher10@pbs.org,36,HandMade Women Cream-Coloured Solid Open Toe Flats,"A pair of cream-coloured open-toed flats, has regular styling, velcro detailSynthetic upperCushioned footbedTextured and patterned outsole",clothes,248
23,Wally Carvell,"79859 Paget Place",1994-09-18,ciskowern@answers.com,23,Pure & Gentle Bathing Bar,"There's nothing like knowing that your skin is soft, smooth and glowing. With the right products, you can have that feeling every single day, starting with your cleansing routine. HandMade understands this and brings to you its heritage product - the original glycerine soap, HandMade Pure & Gentle Bathing Bar. With 100% more glycerine, HandMade Pure & Gentle mild soap bar, cleanses your skin for visibly glowing, brighter skin, every time you shower. This bathing bar with glycerine helps preserve the moisture of your skin and keeps it soft, smooth and glowing. HandMade' gentle formula has 0% Parabens and is mild on the skin. HandMade Soap Bar also helps wash away germs. Just rub the HandMade bar between your hands and massage rich creamy lather over your face and body before rinsing away thoroughly. Pat dry. For best results, use twice a day, morning and evening. HandMade Pure & Gentle Bathing Bar is packed in 100% recyclable cartons, our initiative towards being environmentally friendly. Explore the entire range of HandMade Pure & Gentle Body Wash & Liquid Hand Wash that are 100% soap Free, pH balanced and dermatologically tested. Add the HandMade Range to your beauty regime to see for yourself.",Beauty & Hygiene,230
24,Jerome Dekeyser,"564 International Alley",2004-10-02,mjellicoo@exblog.jp,24,HandMade Women Coral Orange Solid Cinched Waist Top,"Coral orange solid woven cinched waist top with lace detail, has a V-neck, and short extended sleeves",clothes,227
25,Kandace Capnor,"2 Evergreen Center",1990-09-22,skoeppkep@eventbrite.com,25,"Gel Bathing Bar - Multi Variant (Buy 4 & Get 1 Free, 125 g each)","Presenting to you the Gel Bathing Bar Celebration Pack from HandMade. You Buy 4 and Get 1 Free, this pack has all the Fiama Variants in 1 Pack which are: Double Moisture, Exotic Dreams, Clear Spring, Mild Dew & Pure Rio Splash.For Beauty tips, tricks & more visitÂ https://bigbasket.blog/",Beauty & Hygiene,269
26,Warren Hauxwell,"7 Pawling Hill",1992-07-19,jambrosoliq@squidoo.com,26,HandMade Men Checkered Pack of 3 Checkmate Pure Cotton Boxer XYBOX3PCKN107,"Pack of 3 Navy, Grey &  Black  regular-fit checked boxers with a microfibre waistband.Key Features:Intelli Ease:Our Intelli Ease fabric technology makes for the most luxurious comfort wear that guarantees unmatched lightness, softness and breathability. Fit: Relaxed fit for everyday wear.Functionality: Single back patch pocket to keep important belongings and a concealed button placket.Waistband:Soft, Anti-roll, microfibre waistband on the inside with comfort stretch that won't leave any marks.Skin Hygiene:Enhanced with antimicrobial finish to prevent unpleasant odours and rashes..",clothes,61
27,Claudette Espinet,"1396 Burning Wood Crossing",1993-07-10,bteacyr@ifeng.com,27,Soft & Fresh Soap Bar,"HandMade Soft & Fresh Soap is a multi-purpose soap that cleans your skin and keeps it supple all the time. True to its name, the soap gives you a soft and fresh skin instantly.Its active ingredients moisturize your skin from deep within and keeps it looking clean and the pure glycerin and mint extracts give it an instant cool freshness. Give yourself a refreshing shower every day, buy the HandMade Soft & Fresh Soap Bar, right here!  For Beauty tips, tricks & more visit https://bigbasket.blog/",Beauty & Hygiene,212
28,Marisa Fendt,"9 Mitchell Court",1997-05-26,ucuvleys@opensource.org,28,HandMade Men Pink Regular Fit Solid Formal Shirt,"Pink solid formal shirt, has a spread collar, long sleeves, button placket,  straight hem, one patch pocket",clothes,178
29,Northrup Luckett,"32 Tennessee Drive",1991-12-08,dmulreant@pbs.org,29,Handwash - Classic,"HandMade classic hand wash is improved with the normal goodness of Sandalwood and Tulsi that offers interesting double advantage of Tough on Germs and Delicate on Hands. Along with thorough cleansing, the liquid handwash leaves behind a faint, pleasant fragrance and makes the hands extremely soft and smooth.",Beauty & Hygiene,53
30,Seymour Zorzoni,"7473 Bartelt Drive",1992-07-19,econcannonu@sun.com,30,HandMade 05 White MicroLiner Ink 0.08 g,"Shade Name: 05 WhiteWhat Is It:This fool proof eyeliner is infused with high-impact pigments that deliver smudge-proof, saturated, matte colour.What it does:The weightless, inky pencil features thermo-sensory technology that allows this formula to transform from a solid to a liquid upon contact with skin, creating a flexible, water-resistant film that lasts up to 24 hours. The micro-thin lead on this next-generation pencil can be dotted between lashes or glided across eyes with remarkable precision and no skipping. Available in five shades inspired by sumi ink sticks used in traditional Japanese calligraphy.This product is dermatologist- and ophthalmologist-tested. It is formulated without oil, fragrance, and talc.About the Brand:Shiseido is a global, Japanese cosmetics and skincare brand with unique Asian heritage, strong business innovation and positive country-of-origin effects. Shiseido makeup represents an exceptional collection of high-performance colors and textures, created to celebrate and enhance your natural beauty.",clothes,289
31,Sandro Lumly,"5 4th Street",2004-11-09,mcrowterv@ibm.com,31,Bathing Soap - Almond & Rose,"HandMades Almond and Rose Soap merge 100% natural ingredients to return the body's water content. This nongreasy soap departs skin feeling spongy, supple and toned. It developed with almond extracts to refresh and moisturize your skin. It also includes rose which rejuvenates and cools your skin.For Beauty tips, tricks & more visit https://bigbasket.blog/",Beauty & Hygiene,233
32,Edwina Malone,"256 Swallow Avenue",2000-04-13,ydahlbomw@photobucket.com,32,HandMade Women Grey Solid Leather Ballerinas,"A pair of grey square-toe ballerinas with bow detail, has regular stylingLeather upperCushioned footbedTextured and patterned outsole",clothes,136
33,Derrek Coneybeare,"19589 Glendale Lane",2002-03-14,toliveyx@csmonitor.com,33,Orchid & Milk Liquid Handwash Refill,"Natural and 100% soap-free for a gentle hand wash. Leaves your hands feeling soft, moisturised and visibly clean. Infused with the fragrance of an exotic Black Orchid flower. Enriched with the moisturising properties of milk. Also, try the exotic Sea Minerals enriched HandMade Handwash Refill Pack HandMade Naturals Hand Wash with the natural goodness of Black Orchid & Milk is 100% soap-free and gentle on your hands. Infused with the exotic Black Orchid flowers, it makes your hands irresistibly soft. Milk proteins, on the other hand, moisturizes and enriches your skin. The special formula pampers your hands with every wash and delights your senses with its unique fragrance.",Beauty & Hygiene,235
34,Rufe Wicken,"20 Everett Junction",2001-08-06,gbehney@de.vu,34,HandMade Men Taupe Solid Suede Sneakers,"A pair of round-toe taupe solid sneakers, has regular styling, lace-up detailSuede upperCushioned footbedTextured and patterned outsoleWarranty: 6 monthsWarranty provided by brand/manufacturer",clothes,170
213,Lemar Finlaison,"8 Everett Terrace",2002-03-27,otiffin5x@boston.com,213,Luminous Oils Invigorating Handwash,"Premium Sensorial Handwash with the goodness of nature. Rich in essential oils & natural extracts, this handwash comes with a skin neutral PH. This amazing formula is milder on hands. It leaves an incredible fragrance on your hands.",Beauty & Hygiene,95
37,Bayard Linfield,"0 Judy Drive",2002-04-22,owinterbourne11@about.com,37,"Hand Sanitiser - Germ Protection, Original","HandMade is one of the worlds most trusted antiseptic protection brand which give you 99. 99% protection against disease causing bacteria, germs and es. Their hand Sanitiser protects you from 100 illness causing germs and saves you the trouble of washing your hands with soap and water during emergencies.  | Germ protection in the classic HandMade fragrance. 
 | Rinse Free and Non sticky. 
 | Use HandMade Hand Sanitiser to protect transference of germs from your hands anytime, anywhere without the use of soap or water.  | Recommended by the Indian Medical Association.",Beauty & Hygiene,55
38,Charles Meechan,"67 Acker Trail",1994-10-25,ymoss12@reverbnation.com,38,HandMade 04 Navy MicroLiner Ink 0.08 gms,"Shade Name: 04 NavyWhat Is It:This fool proof eyeliner is infused with high-impact pigments that deliver smudge-proof, saturated, matte colour.What it does:The weightless, inky pencil features thermo-sensory technology that allows this formula to transform from a solid to a liquid upon contact with skin, creating a flexible, water-resistant film that lasts up to 24 hours. The micro-thin lead on this next-generation pencil can be dotted between lashes or glided across eyes with remarkable precision and no skipping. Available in five shades inspired by sumi ink sticks used in traditional Japanese calligraphy.This product is dermatologist- and ophthalmologist-tested. It is formulated without oil, fragrance, and talc.About the Brand:Shiseido is a global, Japanese cosmetics and skincare brand with unique Asian heritage, strong business innovation and positive country-of-origin effects. Shiseido makeup represents an exceptional collection of high-performance colors and textures, created to celebrate and enhance your natural beauty.",clothes,274
39,Sidonia Grossier,"2 Crownhardt Hill",1993-04-09,sknill13@time.com,39,Soap - Neem & Turmeric,"HandMades Neem & Turmeric Soap blends together all the goodness of naturally derived ingredients to keep your skin protected at all times. The oils of Neem and Turmeric, which contain antibacterial and antifungal properties, protect your skin from harsh environmental conditions.For Beauty tips, tricks & more visit https://bigbasket.blog/",Beauty & Hygiene,153
40,Lavinie Spare,"099 Vahlen Place",1994-06-11,timison14@ox.ac.uk,40,HandMade Women Blue Solid A-Line Kurta,"Blue solid A-line kurta, has a round neck, three-quarter sleeves, and flared hem",clothes,115
