"craftsman_id","craftsman_name","craftsman_address","craftsman_birthday","craftsman_email","product_id","product_name","product_description","product_type","product_price"
205,Novelia Manes,"85071 Rieder Drive",2003-10-03,omcelree5p@dion.ne.jp,205,Moisture Shield Germ Protection Liquid Handwash - Refill Pouch,"Our hands are hotbeds of germs. Maintaining good hand hygiene is important for staying healthy. Keep your family in safe hands with HandMade€™s advanced range of Handwashes. HandMade Handwash provides effective cleansing and protects you and your family from a million germs. HandMade Handwash also protects against the H1N1, Stomach Flu.  It is dermatologically tested and is suitable for all skin types. Washing your hands is easy, and it€™s one of the most effective ways to prevent the spread of germs. Keep yourself and your loved ones healthy by washing your hands often, especially during these key times when you are likely to get and spread germs - Before, during, and after preparing food, Before and after eating food, after using the toilet and after blowing your nose, coughing, or sneezing.  Break the chain of infection with HandMade Handwash that protects from a million germs Also, Protects from the H1N1, Stomach Flu.  HandMade Moisture Shield Handwash leaves you with soft, supple and clean hands, Gentle cleansing coupled with moisturizing benefit.Dermatologically tested, suitable for all skin types, with natural extracts. No TCC. No Triclosan. No Added Parabens.",Beauty & Hygiene,40
206,Rozella Bendin,"1 Johnson Street",1993-09-10,mworner5q@exblog.jp,206,HandMade Men Blue Regular Fit Printed Formal Shirt,"Blue printed formal shirt, has a spread collar, long sleeves, button placket, curved hem, and 1 patch pocket",clothes,162
209,Andrei Gorioli,"36 Veith Court",1995-04-13,ovasnev5t@pbs.org,209,Gentleman Talc - For Men,"This luxury perfumed talc leaves your skin feeling soft and fragrant throughout the day. The fragrance will keep you refreshed and comfortable. The rich and the authentic fragrances from the house of Yardley, which will keep you energizing and rejuvenating.",Beauty & Hygiene,197
210,Vernon McIlenna,"9 Waubesa Crossing",1991-05-04,dlere5u@washington.edu,210,HandMade Women Green Printed Jacket,"Green printed jacket, has a hooded, 2 pockets, zip closure, long sleeves, straight hem, and polyester",clothes,97
215,Leelah Ivakhno,"4 Gale Circle",1994-07-01,nvan5z@163.com,215,Bathing Bar Soap - Skincare,"HandMade Soap contains nourishing moisturizers that also provides germ protection from a wide range of unseen germs. It helps make skin softer, smoother and healthier. Personal hygiene plays a critical role in preventing the spread of illness and infection, and the lack of it can cause infection, skin complaints and skin infections. Skin is our first line of defence from the outside world and by keeping skin clean and moisturised, the barrier function will stay intact and the overall health and appearance of the skin will be improved. Reassuringly, HandMade protects from a wide range of illness-causing germs and bacteria to help you stay healthy. We have a broad range of products, from the iconic HandMade Original to our skincare range and even products to help you feel fresh all day long.",Beauty & Hygiene,36
216,Ambrosi Pilbury,"87365 Harbort Crossing",1993-05-22,cduggleby60@cargocollective.com,216,HandMade Men IntelliSoft Antimicrobial Micro Modal Pack of 3 Illuminati Briefs XYBRF3PCKN347,"Pack of 3 briefs in Navy & Black with contoured front pouch and anti-microbial finish that prevents odours and rashes.

Key Features:

Intellisoft: Our fabric technology makes for the softest, smoothest and comfiest innerwear ever, making you forget you are wearing anything at all. 
Feel: 3Xsofter and 50% more moisture absorbent than regular cotton.
Snug Fit:Fits your form without clinging to your skin and offers fantastic support.
Waistband:Anti-roll microfibre waistband that doesn't leave marks.
Skin Hygiene:Flat-lock seams are smooth on skin so there is no itching, chafing or irritation.",clothes,55
217,Clo Denyer,"0 Leroy Lane",1992-03-30,aluberti61@scribd.com,217,Pure Hands Deep Cleansing Hand Wash - Tulsi & Lemon,"Enriched with the power of Tulsi, known for it's detoxifying, purifying and antimicrobial properties in combination with Aloe Vera known for it's soothing and moisturizing properties. This handwash prevents excessive dryness of hands.",Beauty & Hygiene,183
218,Pace Brandle,"44 Schlimgen Way",1995-01-01,wtempleton62@gmpg.org,218,HandMade Men Black Solid Leather Comfort Sandals,A pair of black comfort sandalsLeather upper with velcro closureCushioned footbedPatterned rubber outsoleWarranty: 6 monthsWarranty provided by brand/manufacturer,clothes,202
219,Caz Child,"759 Spaight Point",1997-05-27,rfidler63@hostgator.com,219,Body Wash - Oil Clear & Glow,"Try the New HandMade Oil-Clear & Glow body wash, crafted with 98% pure glycerin and lemon flower extract. It is a pure & gentle cleanser that leaves your skin feeling soft, smooth, and moisturised. HandMade Body wash is mild & gentle and cleanses your skin thoroughly. It is 100% soap free & dermatologically tested. With natural oil, it helps moisturise your skin so that it does not get dry.  Benefits of the HandMade Oil-Clear & Glow Body wash:  1) It is 100% Soap Free  2) It is Dermatologically Tested  3) It contains 98% pure glycerin.  For Beauty tips, tricks & more visit https://bigbasket. blog/",Beauty & Hygiene,87
220,Dirk Algy,"206 Daystar Crossing",1993-10-08,jpond64@drupal.org,220,HandMade Women Navy Blue Regular Fit Self Design Formal Shirt,"Navy Blue self-design casual shirt, has a spread collar, three-quarter sleeves, button placket, and curved hem",clothes,140
221,Pennie Rizzello,"4 Annamark Junction",1999-04-24,owatt65@php.net,221,Cool Soap,"HandMade soaps contain nourishing moisturizers that also provide HandMade's trusted germ protection from a wide range of unseen germs. HandMade bar soap efficiently cleanses and protects your skin, helping you stay healthy every day. Personal hygiene plays a critical role in preventing the spread of illness and infection. Poor personal hygiene can cause infection, skin complaints, unpleasant smells and skin infections. Skin is our first line of defence from the outside world and by keeping skin clean and moisturised, the barrier function will stay intact and overall health and appearance of the skin will be improved. Reassuringly, HandMade bathing bar soaps protect from a wide range of illness-causing germs and bacteria to help you stay healthy. Protect your family from diseases like cold and flu by adding a layer of HandMade protection. Personal hygiene, healthy habits with HandMade care to minimise your risk of infection and also enhance your overall health.",Beauty & Hygiene,89
222,Rawley Holdey,"93 Merchant Drive",1994-02-19,cgenicke66@auda.org.au,222,HandMade Men Blue Slim Fit Solid Formal Shirt,"Blue solid formal shirt, has a spread collar, long sleeves, button placket, straight hem, and 1 patch pocket",clothes,255
223,Dinny Gittins,"38177 Stoughton Road",2003-01-24,btellenbach67@accuweather.com,223,Pro Sanitize Hand Sanitizer,"India’s most trusted Ayurvedic brand offers a new range of hand sanitizers - HandMade Pro Sanitize - kills 99.9% germs without the use of soap and water. It is recommended for regular hand cleaning inside your home, office and in public places, especially before consuming food and eatables and after coming in contact with any external surface, pet or a person. It’s recommended since germs spread through coughing and sneezing. Recent evidence has shown that some germs linger on surfaces like doorknobs, desks and phones, and are transferred via the fingers to the mouth, nose or eyes. Sanitising your hands with HandMade Pro Sanitise protects you from the germs transferred from direct contact with an infected person or from an external source.",Beauty & Hygiene,94
224,Petrina Hehnke,"324 Hanover Drive",1990-11-09,bovitz68@spotify.com,224,HandMade Men Pink Regular Fit Solid Formal Shirt,"Pink solid formal shirt, has a spread collar, long sleeves, button placket, straight hem, and 1 patch pocket",clothes,85
225,Mattheus Lackington,"5922 Pankratz Hill",1994-01-28,wde69@blogspot.com,225,Hygienic Hand Sanitiser Liquid,"HandMade’s Hand Sanitiser has a high effectiveness quotient and is available in multiple formats. This 100ml Pack is ideal for on the go sanitizer usage requirements. The Sanitiser comes in a convenient pack and can be stored easily in a bag/purse. Apply on your palms and spread until dry. HandMade Hand Sanitiser Helps break the chain of infection by protecting against a wide range of germs like bacteria, fungi, moulds.",Beauty & Hygiene,17
226,Earvin Coyett,"013 Roxbury Center",1997-10-03,mkumaar6a@sohu.com,226,HandMade Men Fuchsia Solid Polo Collar T-shirt,"Fuchsia solid T-shirt, has a polo collar, and short sleeves",clothes,155
227,Minerva Brookhouse,"997 Brown Center",1993-10-15,pbonniface6b@wiley.com,227,PureGlo Glycerine Soap,"Gift yourself soft, glowing skin with new HandMade PureGlo Bathing Bar. Enriched with Glycerine and Almond Oil, it will give your skin the nourishment it needs and will leave a subtle scent on your skin so that you feel fresh throughout the day.",Beauty & Hygiene,139
228,Chrystal Hansman,"7143 Acker Plaza",1998-07-11,eforrestall6c@booking.com,228,HandMade Men White Slim Fit Printed Formal Shirt,"White printed formal shirt, has a spread collar, long sleeves, button placket, straight hem, and 1 patch pocket",clothes,99
280,Starlene Bisacre,"53 Hanover Park",1993-12-13,anardrup7s@miibeian.gov.cn,280,HandMade Red Printed Table Placemat,Set content: 1 table matShape: RectangleColour: RedPattern: PrintedSuitable For: 1 seater tableMaterial: Cotton,clothes,240
230,Mendie O'Codihie,"853 Marquette Crossing",1993-10-30,lbrawson6e@naver.com,230,HandMade Crocband  Men Olive Green Solid Clogs,"A pair of olive green solid flip flopsCroslite upper materialCushioned footbedOdor-resistant, easy to clean, and quick to dryVentilation ports for enhanced breathabilityLightweight, non-marking solesWater-friendly and buoyantPatterned synthetic outsoleWarranty: 3 monthsWarranty provided by brand/manufacturer",clothes,36
231,Lindsy Luberto,"81 Bayside Plaza",2002-07-05,evamplers6f@businesswire.com,231,Feel the Massage Shower Gel,"The Secret of Thermal Massage transported to your shower with thermal minerals. Its unique formula provides gently scrubbing action & massage feeling experience. Regenerate yourself with this gently exfoliating shower scrub with Dead Sea Salt, Aloe Vera and Water Mint.  Let the fresh fragrance revitalise your body & mind.",Beauty & Hygiene,76
232,Glynda Hovington,"59524 Cambridge Hill",2004-12-02,raberchirder6g@cnn.com,232,HandMade Men Black Leather Formal Slip-Ons,"A pair of black round-toed formal slip-on shoes, has elasticated gussets on both sidesLeather upperCushioned footbedTextured TPR outsole, has a stacked heel",clothes,76
233,Nikoletta Exter,"89 Chinook Crossing",1992-12-19,jhamber6h@globo.com,233,Creme Soft Shower Gel With Almond Oil For Soft Skin,"Discover a soft skin feeling with this gorgeously creamy shower creme that contains caring Almond Oil and has a mild fragrance. Let the mild fragrance indulge your senses, while the skin's pH is balanced. This luscious shower creme with caring Almond Oil turns into a soft foam for smoother, more cared for skin.For Beauty tips, tricks & more visit: https://bigbasket.blog/",Beauty & Hygiene,80
234,Rosalia Durden,"019 Ridgeway Hill",2002-04-27,kbridson6i@illinois.edu,234,HandMade Men Brown Regular Fit Solid Formal Trousers,"Brown solid mid-rise trousers, button closure, and 4 pocketsThe stylist has paired this pair of trousers with a belt. This pair of trousers does not come with a belt",clothes,186
235,Sawyere Lydiard,"095 Oakridge Alley",1994-07-22,bsidney6j@google.co.jp,235,Morning Dew Perfumed Talc 250 g + English Rose Perfumed Talc 250 g,"Yardley Morning Dew exudes freshness that lingers from morning through the day. This is a fine, silky luxury talcum powder. Embrace the vibrant and musky fragrance of white flowers like lily and lotus. This luxurious talcum powder will keep you fresh, smooth, and scented throughout the day.With over 200 years' expertise, HandMade selects only the finest ingredients to create its unforgettable fragrances. This is a fine, silky luxury talcum powder and will leave your skin feeling soft and subtly fragrant all day. This luxurious rose-scented talcum powder will keep you fresh, smooth, and scented throughout the day.",Beauty & Hygiene,123
236,Kimberli Keenlayside,"1376 Butterfield Terrace",2001-08-27,apattlel6k@foxnews.com,236,HandMade Men Red & Off-White Slim Fit Checked Casual Shirt,"Red and off-white checked casual shirt, has a button-down collar, long sleeves, button placket,  curved hem, one patch pocket",clothes,183
237,Brana Chisnall,"4 Waxwing Lane",1991-10-15,ggoosnell6l@google.com.br,237,Sandal & Turmeric Soap 150gx4 + Bathing Soap - Sandal & Almond Milk 150gx3,"HandMade has grown from a traditional south Indian soap to a modern beauty soap that carries the secret of younger-looking skin for women of different age groups. Sandal and Turmeric have been an essential part of the Indian woman's skincare regimen for centuries. The deep acting ingredients of Turmeric and Sandal in the soap provide a smooth, soft and clear skin while also giving a youthful glow to the skin. It has fresh, energizing and a long-lasting fragrance. Its a great solution for problems such as blackhead, acne and skin allergies. It removes tanning, cures skin itching and detoxifies the skin.Deep acting ingredients of Sandal an Almond Milk soften and moisturize your skin making it look younger. The new variant Moisturized Soft Skin provides a whole new bathing experience. A new lingering fragrance enhances the entire experience.For Beauty tips, tricks & more visit https://bigbasket.blog/",Beauty & Hygiene,121
238,Jerad Maypes,"11632 Schlimgen Terrace",1993-02-12,ssowte6m@gravatar.com,238,HandMade Women Yellow & Grey Printed Kurta with Palazzos,"Yellow and grey printed kurta with palazzos Yellow and grey straight calf length kurta, has a mandarin collar, three-quarter sleeves, straight hem, side slitsYellow and grey  Solid palazzos, has partially elasticated waistband, button closure",clothes,65
239,Donnie Neylon,"52 Namekagon Way",1997-02-17,aingilson6n@deviantart.com,239,Germ Protection Hand Wash Pump,"Fight the toughest germs with HandMade Germ-Protection Hand Wash. Equipped with 99.9% Germ - Protection formula, HandMade protects you from disease-causing bacteria.",Beauty & Hygiene,298
240,Linette Tuffin,"0 Autumn Leaf Lane",2001-05-04,nallewell6o@mit.edu,240,HandMade Women Multicoloured Silver-Plated Handcrafted Jewellery Set,"This jewellery set consists of a necklace and a pair of earringsMulticoloured silver-plated handcrafted mult-stranded necklace, has textured and stone-studded detail, a centre piece with multiple danglers, secured with an adjustable lobster claspA pair of matching stud earrings, secured with post and back closure",clothes,249
241,Greer Lalevee,"35 Evergreen Lane",1991-03-20,mmergue6p@weibo.com,241,Body Wash Luminous Oils Enriching Shower Gel with Coconut & Jojoba Oil,"* Luxurious rich blend of coconut & Jojoba oil, infused with botanical oil * Gentle yet thoroughly cleanse your body * Soft, radiant and beautiful looking skin * Pour a little HandMade Luminous Oils Rejuvenating shower gel on a wet loofah, washcloth or hand. Apply gently over wet skin, cleanse and then rinse off for a clean and refreshing feeling. For best results, use a loofah to work up a rich, fragrant lather * Ideal for women & men HandMade Luminous Oils Enriching Shower Gel is a stimulating body wash for everyday freshness. HandMade Luminous Oils Shower Gel lets you enrich your senses with the luxuriously rich blend of coconut & Jojoba oil. The fragrant skincare formula is infused with botanical oil and helps to gently, yet thoroughly cleanse your body. Use this HandMade body wash daily for soft, radiant and beautiful looking skin. So, try it today and let luxury embrace your skin. Use before 24 Months from Manufacturing.",Beauty & Hygiene,52
242,Shantee Sings,"3554 Morningstar Parkway",2002-03-11,cstickney6q@nsw.gov.au,242,HandMade Brown Wall Mounted Wooden Hand Carving Key Holder,Set Content: One keyholderColour: BrownPattern: OwlType: Wall-mounted keyholderFEATURES:- Perfect to organize all your keys at one place. - Can hold up to 6 keys.- Acts as a wall decor & enhances the beauty of your wall.- The key holder is hand carved in wood depicting owl motif.- Hand Carved in Sheesham Wood.- The product has been made by hand and may have slight irregularities that are a natural outcome of the human involvement in the process.- Comes in dark brown color.,clothes,41
298,Evey Shenton,"1182 Quincy Alley",2004-01-03,ochristophle8a@phoca.cz,298,HandMade Men Black Propel EL IDP Sneakers,"Product Design Details:A pair of round-toe black sneakers, has regular styling, lace-up detailTextile upperCushioned footbedTextured and patterned outsoleWarranty: 3 monthsWarranty provided by brand/manufacturer",clothes,84
243,Nelson Brierton,"3126 Arizona Point",1991-08-06,llabdon6r@intel.com,243,Prickly Heat Powder - Cool Gulabjal,"HandMade Cool Gulabjal’s unique Germ. Fighter Formula has the goodness of neem oil and menthol to provide relief from summer skin problems and to keep the skin refreshed. The powder is a specialist in providing 5 benefits: It absorbs sweat, fights body odour, calms rashes, soothes itching and prevents prickly heat. HandMade Cool Gulabjal’s unique Germ Fighter Formula protects you from prickly heat causing germs and soothes the skin, keeping it refreshed. HandMade Cool Gulabjal has the goodness of neem oil and menthol to combat skin problems. The powder effectively absorbs sweat and keeps skin dry, also solving problems of body odour, itching and rashes. For skin relief, sprinkle the prickly heat powder over affected areas, up to 2 times a day. It contains a germ fighter formula that helps fight microbes causing skin problems like rashes due to prickly heat. It is also available in HandMade Cool Gulabjal, Cool Chandan and Cool Herbal variants. HandMade has a heritage of 50 years and is a trusted talcum powder brand in India.",Beauty & Hygiene,141
244,Daryle Lidgertwood,"83 Lakeland Drive",1994-12-21,ckineton6s@apple.com,244,HandMade Men IntelliSoft Antimicrobial Micro Modal Pack of 2 Illuminati Briefs XYBRF2PCKN277,"Pack of 2 briefs in Black & Blue with contoured front pouch and anti-microbial finish that prevents odours and rashes.

Key Features:

Intellisoft: Our fabric technology makes for the softest, smoothest and comfiest innerwear ever, making you forget you are wearing anything at all. 
Feel: 3Xsofter and 50% more moisture absorbent than regular cotton.
Snug Fit:Fits your form without clinging to your skin and offers fantastic support.
Waistband:Anti-roll microfibre waistband that doesn't leave marks.
Skin Hygiene:Flat-lock seams are smooth on skin so there is no itching, chafing or irritation.",clothes,260
245,Samuel Rothert,"83584 Rieder Place",1993-11-01,rgoude6t@printfriendly.com,245,Hexa Advanced Soap,"Utilising the expertise from its rich 50-year-old legacy, HandMade presents the HandMade Hexa Advanced Soap. HandMade Hexa Advanced Soap addresses your increased need for germ protection in keeping with the times. The soap offers advanced protection against Viruses and Bacteria and keeps you protected. Use HandMade Hexa Advanced soap, which is enriched with Hexa Pro Power and protect your family from 99.99% germs. Bring home HandMade's trusted protection. Basis in vitro study with representative microbes. Washes away germs.",Beauty & Hygiene,278
246,Madelon Wigan,"6 School Plaza",1992-02-17,lsimons6u@cnbc.com,246,HandMade Men Blue Slim Fit Self Design Formal Shirt,"Blue self-design formal shirt, has a spread collar, long sleeves, button placket,  straight hem, one patch pocket",clothes,98
247,Natalina Whitbread,"94786 Straubel Parkway",2003-09-22,chouseago6v@huffingtonpost.com,247,Hand Wash - Anti-Bacterial,"Fight the toughest germs with HandMade Germ-Protection Hand Wash. Equipped with a 99.9% Germ - Protection formula, HandMade protects you from disease-causing bacteria. Keep yourself healthy by regularly washing your hands.",Beauty & Hygiene,175
248,Lilla Gaynesford,"6610 Lukken Avenue",1990-04-02,eroaf6w@fda.gov,248,HandMade Men Printed Pack of 3 Remix Pure Cotton Boxer XYBOX3PCKN139,"Pack of 3 Black, White & Blue regular-fit printed boxers with a microfibre waistband and pockets on both sides.Key Features:Intelli Ease:Our Intelli Ease fabric technology makes for the most luxurious comfort wear that guarantees unmatched lightness, softness and breathability. Fit: Relaxed fit for everyday wear.Functionality: Dual side pockets to keep important belongings and a concealed button placket.Waistband:Soft, Anti-roll, microfibre waistband on the inside with comfort stretch that won't leave any marks.Skin Hygiene:Enhanced with antimicrobial finish to prevent unpleasant odours and rashes..",clothes,190
249,Lindi Ceaplen,"0294 Monica Parkway",1994-03-20,mwellbeloved6x@barnesandnoble.com,249,Germ Protection Hand Sanitizer,"HandMade Hand Sanitizer keeps you protected from germs anytime and anywhere. It kills 99.9% germs without water and soap. This gel-based sanitizer kills 99.9% germs. It contains more than 60% alcohol leaving your hands feeling clean and soft with a pleasant fragrance. Squeeze a small quantity on to your palms, spread and rub thoroughly till dry. Also available in 500ml.",Beauty & Hygiene,198
250,Phil Raisher,"345 6th Way",2003-04-12,fmatyas6y@mediafire.com,250,HandMade Men Blue Slim Fit Printed Formal Shirt,"Blue printed formal shirt, has a spread collar, long sleeves, button placket,  straight hem, one patch pocket",clothes,61
251,Lilllie Crate,"95 Jackson Plaza",2001-03-26,lgissop6z@plala.or.jp,251,Happy Moisturising Hand Wash - Grapefruit & Bergamot,"HandMade liquid handwash contains fragrance that is proven to make you feel fresh. The gel formulation contains skin conditioners that make your hands soft and has natural germ protection to keep your hands safe. Available in 3 variants; happy, relax, and fresh.",Beauty & Hygiene,291
252,Ardis Pavolini,"40201 Texas Hill",1995-09-22,apardy70@forbes.com,252,HandMade Men Checkered Pack of 5 Checkmate Pure Cotton Boxer XYBOX5PCKN05,"Pack of 5 Navy+Grey+Red & Black  regular-fit checked boxers with a microfibre waistband.Key Features:Intelli Ease:Our Intelli Ease fabric technology makes for the most luxurious comfort wear that guarantees unmatched lightness, softness and breathability. Fit: Relaxed fit for everyday wear.Functionality: Single back patch pocket to keep important belongings and a concealed button placket.Waistband:Soft, Anti-roll, microfibre waistband on the inside with comfort stretch that won't leave any marks.Skin Hygiene:Enhanced with antimicrobial finish to prevent unpleasant odours and rashes..",clothes,280
253,Laurice Whaley,"2014 Declaration Terrace",1990-06-25,dlansdowne71@bbb.org,253,Handwash Refill Pack,"HandMadeHandwash comes with the goodness of Ayurveda. It is specially formulated with natural essential oils for effective germ protection for your hands. It effectively removes germs from your hand, leaving them clean and healthy. Its all-natural approach is scientific, safe, and effective. Today, close to 80 years since it was first made, HandMadeis loved by millions of households all over the globe and is still synonymous with Ayurveda.",Beauty & Hygiene,25
254,Foss Healings,"62 Larry Plaza",1993-11-16,dlagde72@epa.gov,254,HandMade Women Black Sequinned Slip-On Sneakers,"A pair of round-toe black slip-on sneakers, has zip closureSynthetic upper with sequin detailCushioned footbedTextured and patterned outsoleWarranty: 6 monthsWarranty provided by brand/manufacturer",clothes,39
297,Elsa Syphas,"033 Clemons Junction",1994-05-05,achadwick89@noaa.gov,297,Pure&Safe Instant Hand Sanitizer,"HandMade Hand Sanitizer helps kill 99.99% of germs and bacteria and provides effective protection. Sanitize your hands frequently with this self-drying gel after shaking hands, visiting hospitals, using public transport and conveniences, coughing or sneezing, touching doorknobs, escalator rails, elevator buttons, etc.",Beauty & Hygiene,113
322,Phillis Belson,"3367 Pearson Way",1994-02-21,blink8y@utexas.edu,322,HandMade Men Off-White & Maroon Slim Fit Checked Casual Shirt,"Off-White and Maroon checked casual shirt, has a spread collar, long sleeves, button placket, curved hem, and 1 patch pocket",clothes,295
