"craftsman_id","craftsman_name","craftsman_address","craftsman_birthday","craftsman_email","product_id","product_name","product_description","product_type","product_price"
440,Alanah Ledson,"25417 Pleasure Street",1996-04-30,fcasarinic8@t-online.de,440,HandMade 03 Cosmic Aura Dew Face Eyes Lips Highlighter 4.8g,"Colour shade name: CosmicColour shade number: 03What it isHoused in a luxurious glass jar, Shiseido Aura Dew - Face, Eyes, Lips is a divine multi-use cream highlighterthat immediately illuminates the skin. This multidimensional highlighter suspends ultra-fine rose, silver, and gold Japanese pearls in a cushiony, transparent base that melds seamlessly with every skin tone.What it doesThis multi-use highlighter transforms and illuminates the skin with a breathable, formula that feels invisible and lasts for 12 hours.Features:lts revolutionary texture ensures that this highlighter stays put for 12 hours without caking and can be easily layered over eye, lip, or cheek products without compromising color or adding weight.This product is dermatologist- and ophthalmologist- tested.",clothes,56
441,Ric Tunna,"124 Eliot Lane",1994-02-10,rthyerc9@tinypic.com,441,Disney Princess - Bio Almond Princess Nourishing Soap,"This clear soap is blended with nourishing almond, margosa and coconut oils, mixed with turmeric and wild turmeric, to gently wash away body impurities, without disturbing the skins natural pH balance. It is recommended for sensitive body types.",Beauty & Hygiene,121
442,Conny Abarough,"7 Meadow Ridge Street",1994-07-27,sscarfeca@bandcamp.com,442,HandMade Men Blue Regular Fit Self Design Formal Shirt,"Blue self-design formal shirt, has a spread collar, long sleeves, button placket, straight hem, and 1 patch pocket",clothes,16
443,Cal Boobyer,"0332 Esker Plaza",1996-11-17,eeimcb@rambler.ru,443,Hand Sanitizer,HandMade Hand Sanitiser is 70% Ethanol based premim hand sanitiser. Product meets WHO standards and is having refreshing colgone fragrance. Kills 99.9% germs without using water or soap. Rub across all fingers and tips carefully.,Beauty & Hygiene,259
444,Toiboid Lyver,"510 Pleasure Trail",1995-05-16,rhedinghamcc@netvibes.com,444,HandMade Men Navy Blue Synthetic Running Shoes,"A pair of navy blue running sports shoes, has regular styling, lace-up detailSynthetic upperCushioned footbedTextured and patterned outsole",clothes,146
460,Katine Bredes,"054 Morningstar Crossing",2004-03-24,iuzzellcs@behance.net,460,HandMade Women Black Solid Leather Pumps,"A pair of black round toe pumps, has regular styling, closed back detailLeather upperCushioned footbedTextured and patterned outsole, has a block heelWarranty: 6 monthsWarranty provided by brand/manufacturer",clothes,44
461,Tedman Thorington,"468 Shelley Hill",1992-12-24,ktimminsct@squidoo.com,461,Moisturising Bar - Gel + Creme,"Dive into a luxurious bathing experience with HandMade Clear Springs Gel Bathing Bar, which is handcrafted using ITCs revolutionary Liquid Freezing Technology which freezes gel into a bar.",Beauty & Hygiene,25
445,Prudy Diben,"32605 Surrey Junction",1997-01-07,bvancd@springer.com,445,Original Germ Protection Liquid Handwash,"Be 100% sure to protect your skin from 100 illness-causing germs* and bacteria. Use HandMade's Liquid Handwash pH balanced formula every day and keep your hands hygienically clean and refreshed. This handwash provides a soft and rich lather, leaving behind clean hands and mild pine fragrance. The trusted germ-protection modus operandi acts like a barrier between your hands and a wide range of unseen germs.The soap-free formula with glycerin makes sure to keep your skin moisturised, while the plant-derived cleansers help ensure thorough cleaning. HandMade Handwash also contains more than 85% naturally derived ingredients with no TCC & Triclosan, giving another healthy reason for handwashing whenever in need. Wash hands properly with HandMade and helps keep your family healthy! Also available in 750ml and 900ml liquid handwash refill pack sizes.",Beauty & Hygiene,55
446,Livvyy Benallack,"18229 Columbus Avenue",2004-04-19,lmievillece@ebay.com,446,HandMade Women Blue Printed Kurta with Palazzos,"Blue printed kurta with palazzos Blue straight calf length kurta, has a mandarin collar, three-quarter sleeves, straight hem, side slitsBlue  Printed palazzos, has elasticated waistband, slip-on closure",clothes,104
447,Brandea Revey,"6 Golf Plaza",1996-10-13,csartoncf@cbsnews.com,447,"Loofah/Sponge Scrubber/Body Bath - With Hand Band, Cream, BH-030 CRM","Improve the blood circulation of your skin and eliminate the dead skin cells by using this loofah. The loofah sponge is composed of slightly coarse fibres that exfoliate the skin, resulting in the smooth and glowing skin. It features the hand support band that fixes your hand in one place and results in smooth and easy bathing.",Beauty & Hygiene,93
448,Giles Garthside,"99893 Rutledge Circle",1997-11-01,kseidecg@creativecommons.org,448,HandMade Men IntelliSoft Antimicrobial Micro Modal Pack of 2 Illuminati Briefs XYBRF2PCKN273,"Pack of 2 briefs in Black & Grey with contoured front pouch and anti-microbial finish that prevents odours and rashes.

Key Features:

Intellisoft: Our fabric technology makes for the softest, smoothest and comfiest innerwear ever, making you forget you are wearing anything at all. 
Feel: 3Xsofter and 50% more moisture absorbent than regular cotton.
Snug Fit:Fits your form without clinging to your skin and offers fantastic support.
Waistband:Anti-roll microfibre waistband that doesn't leave marks.
Skin Hygiene:Flat-lock seams are smooth on skin so there is no itching, chafing or irritation.",clothes,173
449,Gilbert Thunnercliff,"4 Ridgeway Street",1996-11-06,tsemeradovach@barnesandnoble.com,449,Handwash Refil Pack,"HandMadeHandwash with the goodness of Ayurveda is specially formulated with natural essential oils for effective germ protection for your hands. It effectively removes germs from your hand, leaving them clean and healthy. It's pure, natural care you can trust.",Beauty & Hygiene,291
450,Byram Vlach,"44 Summer Ridge Lane",1992-02-27,nbarthelemyci@mozilla.com,450,HandMade Multicoloured Printed Table Runner,Set content: One runnerType: Table runnerColour: multicolouredFabric: PolycottonShape: RectangularPattern: FloralDisclaimer : Product colour may slightly vary due to photographic lighting sources or your monitor settings.,clothes,79
451,Allianora Crew,"96 Buell Trail",2003-12-20,svowellcj@cafepress.com,451,Creme Care Soap - For Hands & Body,"HandMade soaps offer reliable cleansing abilities with the caring qualities you expect from HandMade. Natural care substances support your skin in keeping its moisture, day by day. With HandMade cream soap, enriched with valuable almond oil, mild skin ingredients and vitamin f your skin gets smooth and gentle care and is protected from drying out.For Beauty tips, tricks & more visit https://bigbasket.blog/",Beauty & Hygiene,182
452,Pauletta Hay,"482 Magdeline Place",1996-12-14,learlesck@businessinsider.com,452,HandMade Women Black Textured Leather Ballerinas,"A pair of black square toe ballerinas, has regular styling, slip-on detailLeather textured upper with metallic detailCushioned footbedTextured and patterned outsoleWarranty: 6 monthsWarranty provided by Brand Owner / Manufacturer",clothes,118
453,Kennedy Josipovitz,"5 Clove Way",1992-11-08,dtroodcl@usgs.gov,453,Body Wash Gel - Waterlily & Oil Shower,"Give your skin refreshing care with HandMade waterlily and oil shower gel. Enriched with care oil pearls that moisturise your skin, making it soft and supple. Let this fresh shower gel envelop your skin with a silky soft foam, while its invigorating scent of waterlily flowers stimulates your senses.",Beauty & Hygiene,12
454,Cherish De Castri,"48041 Farwell Pass",1995-09-16,smacuracm@slideshare.net,454,HandMade Men Grey & White Striped Polo Collar T-shirt,"Grey and White striped T-shirt, has a polo collar, short sleeves, and 1 pocket",clothes,78
455,Jamesy Masi,"90 Melvin Place",2003-01-02,mheddecn@booking.com,455,Neem Tulsi & Aloe Vera Soap,"HandMadeis a brand that has consistently stood by its promise of honesty and safety for the last 89 years and continues to do so. HandMadeharnesses the best of nature to provide safety and protection to your skin and that’s why it has stood the test of time as a component of the wisdom mothers pass on to their children to keep them safe. Now your favourite HandMadeis available in a pack of 8. It harnesses one of nature’s most potent protectors with 100 per cent pure neem oil and complements it with two of nature’s most effective caregivers - Tulsi and Aloe vera to bring together the best solution to fight your skins battles against dust, sweat and pollution. It does not merely cleanse your skin, it purifies it. HandMadepromises you a bath that will evoke the best of nature. Go safe outside with the best ever HandMadeskin protection. Go safe outside with the best ever HandMadefragrance. HandMadeaims to be your choice of a companion as you get ready to step out to take on the challenges of the world. So, what are you waiting for? Try the best ever HandMadeSoap and Go Safe Outside.",Beauty & Hygiene,12
456,Skippie Brymham,"02058 Alpine Court",1994-11-26,kmcalisterco@sourceforge.net,456,HandMade Men Printed Pack of 3 Remix Pure Cotton Boxer XYBOX3PCKN131,"Pack of 3 Black, Light Blue & Navy regular-fit printed boxers with a microfibre waistband and pockets on both sides.Key Features:Intelli Ease:Our Intelli Ease fabric technology makes for the most luxurious comfort wear that guarantees unmatched lightness, softness and breathability. Fit: Relaxed fit for everyday wear.Functionality: Dual side pockets to keep important belongings and a concealed button placket.Waistband:Soft, Anti-roll, microfibre waistband on the inside with comfort stretch that won't leave any marks.Skin Hygiene:Enhanced with antimicrobial finish to prevent unpleasant odours and rashes..",clothes,248
457,Valdemar Cristofor,"379 Rowland Point",1993-10-20,jtokecp@sbwire.com,457,Air & Surface Disinfectant Spray,ZM Labs Surface & Air Disinfectant Spray is just what your home needs. It instantly kills 99.9% of bacteria. ZM Labs Surface & Air Disinfectant Spray disinfects not just air but also hard and soft surfaces in your house. It comes in an easy spray can which makes it convenient to use. Ethanol content is 70% and our special formulation makes it safe on skin. ZM Labs Surface & Air Disinfectant Spray is the best way to keep your surfaces disinfected.,Beauty & Hygiene,268
462,Terrel Colrein,"1 New Castle Road",1990-04-19,modulchontacu@washingtonpost.com,462,HandMade Men Printed Pack of 3 Remix Pure Cotton Boxer XYBOX3PCKN138,"Pack of 3 Black, Yellow & Blue regular-fit printed boxers with a microfibre waistband and pockets on both sides.Key Features:Intelli Ease:Our Intelli Ease fabric technology makes for the most luxurious comfort wear that guarantees unmatched lightness, softness and breathability. Fit: Relaxed fit for everyday wear.Functionality: Dual side pockets to keep important belongings and a concealed button placket.Waistband:Soft, Anti-roll, microfibre waistband on the inside with comfort stretch that won't leave any marks.Skin Hygiene:Enhanced with antimicrobial finish to prevent unpleasant odours and rashes..",clothes,228
463,Edwina Nizet,"5 Del Sol Hill",1990-11-21,ajentetcv@icq.com,463,Rose Water Soap,Rosewater soap is rich in vitamins that are essential in maintaining the ph levels of the skin. Regular use of this soap keeps your skin feeling soft and rejuvenated in the most natural way.,Beauty & Hygiene,194
464,Les Gurdon,"95 Warbler Plaza",2002-05-31,rcorbyncw@weather.com,464,HandMade Women Maroon Embroidered Straight Kurta,"Maroon embroidered straight kurta, has a mandarin collar, three-quarter sleeves, straight hem, side slits",clothes,60
465,Aleen Giacovetti,"18961 Heath Center",1999-07-01,tmandreycx@dagondesign.com,465,Hand Sanitizer - 70% Alcohol Base,"70%Alcohol based is gentle of hand leaves skin soft and moist with a good fragrance. It is really safe for the skin.",Beauty & Hygiene,260
466,Davy Wyss,"60 Loeprich Trail",2001-07-30,aputtancy@discuz.net,466,HandMade Women Black Solid Leather Pumps,"A pair of black pointed toe pumps, has regular styling, backstrap detailLeather upperCushioned footbedTextured and patterned outsole, has a slim heelWarranty: 6 monthsWarranty provided by brand/manufacturer",clothes,222
467,Katerina Matuskiewicz,"8 Garrison Point",1993-01-30,cmcnabcz@shop-pro.jp,467,Bio Honey Cream Rejuvenating Body Wash - 100% Soap Free,"This rejuvenating, anti-bacterial wash is a blend of pure honey and extracts from the bark of the arjun tree, euphorbia plant and wild turmeric, to keep hands clean, soft and younger-looking. Featuring a pump dispenser for easy use in bathrooms, kitchens or wherever, be germ-free all the time with Biotique.",Beauty & Hygiene,66
468,Priscella Braghini,"6 American Hill",1999-03-03,aiorid0@forbes.com,468,HandMade Blue & Yellow Printed Tissue Holder,Set Content: 1 tissue holderPattern: PrintedColour: Blue and yellowFinish: MatteMaterial: Wood,clothes,111
469,Horatius Mulles,"5 Cottonwood Avenue",1993-06-19,gbrentd1@nymag.com,469,"Sugar Sensation Foot File - Sky Blue, Colour May Vary","Presenting premium quality foot technology brought to the next performance level. HandMade sugar sensation foot file with sugar like texture gently softens, exfoliates and smoothens feet in or out of the shower. Contoured handle and dual-sided file offer ease of use. Start with the ball of your foot, bottom of your toes and move to your heel. Rub in a circular motion on rough or callused skin. Perfect for home or to bring to the salon.",Beauty & Hygiene,192
470,Barbee Boyn,"3371 Schlimgen Pass",2000-03-27,keltund2@discovery.com,470,HandMade Women Blue Analogue Watch 14631-307,"Display: AnalogueMovement: QuartzPower source: BatteryDial style: Solid round stainless steel dialFeatures: Reset TimeStrap style: Blue bracelet style, stainless steel strap with a foldover closureWater resistance: 30 mWarranty: 3 yearsWarranty provided by brand/manufacturerComes in a signature HandMade case",clothes,178
471,Shellysheldon Hastin,"7 Pepper Wood Road",2000-06-20,clammertzd3@deliciousdays.com,471,Hand Wash - Moisture Shield,"HandMade liquid handwash effectively removes dirt and germs, leaving your hands perfectly clean.  For Beauty tips, tricks & more visitÂ https://bigbasket.blog/",Beauty & Hygiene,119
472,Valentijn Snowsill,"924 Eagle Crest Crossing",2003-10-18,tzorend4@instagram.com,472,HandMade Men Purple Slim Fit Solid Casual Shirt,"Purple solid casual shirt, has a spread collar, long sleeves, button placket, straight hem, and 1 patch pocket",clothes,246
473,Kathrine Saylor,"76 High Crossing Avenue",1995-09-30,eskymd5@nature.com,473,Body Cleanser - Saundarya Sandal,"For healthy & fair skin. Made from natural oil cleanser base, sandal wood oil extract of aloe vera which cleanses gently and keeps your skin glorified & soft, forever young and beautiful. Useful in nourishing, rejuvenating & glorifying the skin.  For Beauty tips, tricks & more visit https://bigbasket.blog/",Beauty & Hygiene,275
474,Roderigo Tunstall,"70026 Sloan Place",2001-05-16,jwylied6@hibu.com,474,HandMade Men White Regular Fit Printed Formal Shirt,"White printed formal shirt, has a spread collar, long sleeves, button placket, straight hem, and 1 patch pocket",clothes,74
475,Vonni Wickey,"3675 Meadow Ridge Junction",2004-03-23,nbergerd7@odnoklassniki.ru,475,"Antiseptic + Moisturising Soap - Neem, Eucalyptus & Honey","BoroPlus Antiseptic + Moisturising Soap Neem, Eucalyptus & Honey
• Kills 99.99% Germs and Kills Virus
• Softens and Moisturises Skin
• From India’s No. 1 Antiseptic# Brand
• Recommended by Doctors
• Gives Healthy Skin
• Enriched with Antiseptic & Healing Power of Neem & Eucalyptus
• Moisturising power of Honey
• Protects your entire family Free from Paraben, Silicones and Artificial colourants Anti-bacterial Toilet soap: Grade 1. TFM 76%",Beauty & Hygiene,32
476,Andriana Stair,"6 Carberry Pass",1990-06-08,cprozesckyd8@google.nl,476,HandMade Men Black Regular Fit Printed Formal Shirt,"Black printed formal shirt, has a spread collar, long sleeves, button placket, straight hem, and 1 patch pocket",clothes,94
477,Chickie Riddich,"0397 Clemons Parkway",1996-05-23,rvereckerd9@pcworld.com,477,Himalayan Pink Salt Body Wash With Water Lily,"Himalayan Pink Salt Shower Gel, rich in skin-friendly minerals and with therapeutic properties finds its way in an indulgent body wash with the goodness of 100% pure Pink Himalayan Salt that fights acne and gently conditions the skin. Blended with elements of pure White Water Lily that balances cell renewal in the skin, this luxurious shower gel from ST D‚¬„¢VENCE soothes and detoxifies irritated skin. So, pamper your skin and awaken your senses every day with this soothing and refreshing shower gel.",Beauty & Hygiene,114
478,Netty Olorenshaw,"1716 Anthes Circle",1998-05-14,mkeepingda@webnode.com,478,HandMade Men Black Leather Formal Derbys,"A pair of black round-toed formal derbys, has central lace-upsPatent leather upperCushioned footbedTextured leather outsole, has a stacked heel",clothes,197
479,Janie Spurling,"7 Victoria Lane",2004-01-29,efishburndb@cdc.gov,479,Almond & Rose Soap,"Almond & Rose Soap Moisturizes and Cools Skin: Is enriched with Almond Oil that moisturizes dry skin and Rose which cools and refresh your skin, naturally.  For Beauty tips, tricks & more visit https://bigbasket.blog/",Beauty & Hygiene,254
480,Laurel Steele,"934 Corry Drive",1997-04-19,dmaccrachendc@google.com,480,HandMade Yellow & Blue Printed Table Placemat,Set content: 1 table mat Shape: Rectangle Colour: Yellow and blue Pattern: Printed Suitable For: 1 seater table Material: Cotton ,clothes,171
481,Cacilia Burdis,"093 La Follette Way",2002-12-07,rwaddilowdd@businessweek.com,481,Gel Bar - Peach & Avocado Mild Dew,"HandMade Di Wills Gel Bathing Bars range contains the unusual Dream, the Clear Springs and the Mild Dew. They all have normal ingredients and technical beads that make the skin nice-looking and soft. It cleanses the skin effectively and eliminates all dirt and oil from this skin.  For Beauty tips, tricks & more visitÃ‚ https://bigbasket.blog/",Beauty & Hygiene,278
482,Joline Darragon,"45 Little Fleur Trail",2004-08-14,abrighousede@spiegel.de,482,HandMade Men Yellow Regular Fit Solid Formal Shirt,"Yellow solid formal shirt, has a spread collar, long sleeves, button placket,  straight hem, one patch pocket",clothes,155
483,Amble Hanning,"9551 Summit Point",2002-09-15,obuarddf@nih.gov,483,Natural Oval Loofah - Colour May Vary,"HandMade Natural Oval Loofah is an oval-shaped essential bath tool which exfoliates, deep cleanses and removes toxins, leaving you with a radiant complexion. It has naturally anti-ageing and skin rejuvenating properties by stimulating blood flow. It removes dead skin, reduces blemishes and helps clear acne breakouts as well.",Beauty & Hygiene,170
484,Debbi Jephcote,"699 High Crossing Trail",2000-02-09,crenoufdg@liveinternet.ru,484,HandMade Women Black Solid Bomber Jacket,"Black solid jacket, has a stand collar, 2 pockets, zip closure, long sleeves, straight hem, and polyester",clothes,178
485,Lenard Roth,"505 Quincy Court",1996-11-10,ostobbsdh@slashdot.org,485,"Foot Pumice Paddle - Milky White, Colour May Vary","HandMade foot pumice paddle comes with easy thumb grip handle. Pumice works well in softening and smoothing while removing corns and calluses. Perfect for bath or shower, use regularly to keep skin soft and smooth. Rinse and air dry after use.",Beauty & Hygiene,132
486,Brenden Culham,"3 Alpine Terrace",1998-11-25,jinskippdi@github.io,486,HandMade Men Grey Slim Fit Self Design Formal Trousers,"Grey self-design mid-rise trousers, button closure, and 4 pocketsThe stylist has paired this pair of trousers with a belt. This pair of trousers does not come with a belt",clothes,85
487,Kelby Eschelle,"6108 Rockefeller Road",1996-11-02,sfowledj@yellowpages.com,487,Pumic Stone No 12,"A small block of lightweight, hardened lava foam - sloughs off tough, dry skin and dead skin cells, usually from theÂ feet, elbows or. - to remove hardened skin or calluses with metal tools,Â razorÂ blades or steel  For Beauty tips, tricks & more visitÂ https://bigbasket.blog/",Beauty & Hygiene,185
488,Aristotle Bendelow,"241 Messerschmidt Alley",1993-08-02,ageroldinidk@house.gov,488,HandMade Women Beige & Blue Floral Print Fit & Flare Dress,"Beige, blue and pink printed woven fit and flare dress, has shoulder straps, concealed zip closure, an attached lining, and flared hemComes with a belt",clothes,149
489,Corie Ragbourn,"439 Browning Pass",1991-04-25,adurndl@nih.gov,489,"Bath Loofah - Lilac Purple, Colour May Vary","HandMade bath puff, fuller and heavier is an essential tool for the bath and shower. Great for skin exfoliation and thoroughly cleaning the body. You only need to use a little bit of shower gel or soap to produce a lot of foamy lather. Rinse and hang on the wall to air dry and keep your puff safe and hygienic.",Beauty & Hygiene,90
490,Aila Seebert,"39 Portage Terrace",2002-12-06,cfishburndm@google.co.uk,490,HandMade Women Brown Yoke Design Straight Kurta,"Brown yoke design straight kurta, has a keyhole neck, three-quarter sleeves, curved hem, side slits",clothes,129
491,Delia O'Canavan,"7 Ridgeview Crossing",1999-12-18,yfullalovedn@businessinsider.com,491,Bathing Soap - Kesar & Milk Cream,"Favoured by over 380 million consumers, HandMade offers you 'nature's way to beauty' with carefully chosen natural ingredients to make your skin naturally beautiful. It is Grade 1 quality soap and the highest-selling soap of its kind in the country. Saffron, the age-old skin brightening ingredient has been combined with rich milk cream in this HandMade Kesar and Milk Cream soap, to give you a skin that is glowing and soft at the same time. Use it every day to experience a unique natural glow! It preserves the young nature of your skin giving you a perfect complexion. It protects your skin and gives you a youthful and young look.",Beauty & Hygiene,40
492,Trenton Burn,"757 Eliot Court",1991-10-25,kswando@irs.gov,492,HandMade Men White & Red Slim Fit Striped Formal Shirt,"White and red striped formal shirt, has a spread collar, long sleeves, button placket,  curved hem, one patch pocket",clothes,128
493,Arlinda Lehrahan,"42242 Armistice Plaza",1997-03-11,elinklaterdp@skype.com,493,Hexa Advanced Germ Protection Bathing Soap,"HandMade presents the HandMade Hexa Advanced soap. HandMade Hexa Advanced soap addresses your need for germ protection in keeping up with the times. The soap offers protection against viruses and bacteria* and helps keep you protected. Use HandMade Hexa Advanced soap, with Hexa Pro Power and protect your family from 99.99% germs.* Bring home HandMade's protection. Basis lab study on H1N1 Virus and Rotavirus. Washes away germs.
*Basis lab study on Sample Microbes. Washes away germs.",Beauty & Hygiene,59
494,Jeffie Golson,"7386 Hoard Trail",2004-01-02,wmargarsondq@storify.com,494,HandMade Men Printed Pack of 2 Remix Pure Cotton Boxer XYBOX2PCKN156,"Pack of 2 Yellow & Black regular-fit printed boxers with a microfibre waistband and pockets on both sides.Key Features:Intelli Ease:Our Intelli Ease fabric technology makes for the most luxurious comfort wear that guarantees unmatched lightness, softness and breathability. Fit: Relaxed fit for everyday wear.Functionality: Dual side pockets to keep important belongings and a concealed button placket.Waistband:Soft, Anti-roll, microfibre waistband on the inside with comfort stretch that won't leave any marks.Skin Hygiene:Enhanced with antimicrobial finish to prevent unpleasant odours and rashes..",clothes,44
495,Jammal Mottershead,"7 Granby Place",2003-03-21,phigounetdr@accuweather.com,495,No.1 Bathing Soap - Lime & Aloe Vera,"Favoured by over 380 million consumers, HandMade offers you 'nature's way to beauty' with carefully chosen natural ingredients to make your skin naturally beautiful. It is Grade 1 quality soap and the highest-selling soap of its kind in the country. HandMade Lime and Aloe Vera soap has a dash of lime, known for its invigoration properties, has been combined with the gentleness of Aloe Vera, which retains the skin's moisture to keep it soft. The combination of these ingredients leaves your skin feeling fresh and soft. It preserves the young nature of your skin giving you a perfect complexion. It protects your skin and gives you a youthful and young look.",Beauty & Hygiene,68
496,Cyndi Rewan,"79 High Crossing Drive",1996-08-26,candrionids@surveymonkey.com,496,HandMade Men Blue Slim Fit Striped Formal Shirt,"Blue striped formal shirt, has a spread collar, long sleeves, button placket,  straight hem, one patch pocket",clothes,54
497,Anselm Lockton,"221 Lakewood Center",1999-05-30,wmeasdt@typepad.com,497,Hand Soap - Green & Apple,"HandMadehand wash green Tea apple Protects Restores Moisture.  For Beauty tips, tricks & more visitÂ https://bigbasket.blog/",Beauty & Hygiene,82
499,Mariam Wannell,"57 Di Loreto Drive",1993-05-03,hraedv@infoseek.co.jp,499,Perfumed Talc - Fresh Flower Shower,"Get your favourite HandMade deo talc and cast a spell with its mesmerizing fragrances. It is 100% talc with absolutely no fillers and contains Triclosan, a key agent that fights body odour. It also has long-lasting international fragrances that will help you stay morning-fresh all-day long.  For Beauty tips, tricks & more visitÃ‚Â https://bigbasket.blog/",Beauty & Hygiene,194
500,Craggie Lillyman,"545 Mallory Alley",2004-12-15,agammettdw@google.ca,500,HandMade Rust Set of 5 Ethnic Motifs Square Cushion Covers,Set content: 5 Cushion Covers Colour: Rust Shape: Square Pattern: Ethnic Motifs Closure: Zip,clothes,34
