"craftsman_id","craftsman_name","craftsman_address","craftsman_birthday","craftsman_email","product_id","product_name","product_description","product_type","product_price"
755,Rance Jentzsch,"74901 Maywood Road",1990-01-25,nhartupkz@dyndns.org,755,Rose & Lychee Soap,HandMade's distinctive combination of rose and lychee fragrance inspired us to create an entire range of skincare products. A playful charm with a whole dose of tender care come together to add the perfect dash of character to this blend of fruity and floral fragrance. The HandMade Rose and Lychee handmade soap are created to pamper your skin with the wholesome goodness of Rose petal extract and Lychee extract. The pure play of aroma with the goodness of natural ingredients create this bath soap to pamper your skin. Rose petal extracts moisturise your skin while proving beneficial for skin toning. It also soothes sensitive skin. The pure Lychee extracts are an excellent source of Vitamin C and it also helps reduce facial lines.,Beauty & Hygiene,234
756,Guenna Kobsch,"856 Clyde Gallagher Point",1992-10-24,dbransgrovel0@1688.com,756,HandMade Pink & Green Printed Table Placemat,Set content: 1 table matShape: RectangleColour: Pink and greenPattern: PrintedSuitable For: 1 seater tableMaterial: Cotton,clothes,134
757,Waiter Bootell,"566 Gateway Terrace",2000-09-20,acricketl1@scientificamerican.com,757,Shea Butter Soap,"It has a unique and sophisticated fragrance of Honey and saffron. Shea Butter is a luxurious active base butter soap from HandMade. ActiveBase is an exclusive and unique blend of six pure and natural carrier oils, essential oils and extracts that go into every HandMade handmade soap, namely aloe vera Extract, grape seed extract, honey, cold pressed sweet almond oil, cold pressed wheatgerm oil and Vitamin E Acetate. These ingredients work best as moisturisers, healers and soothing agents. Shea butter is a fantastic moisturiser, great for people with ageing skin. The butter contains a natural sun protectant and is high in Vitamin A and Vitamin E. HandMade's luxurious shea butter soap contains two nutritious ingredients such as saffron and honey that helps to keep skin healthy and glowing. Saffron, perhaps the most expensive herb on earth, is proven to be a natural way to formulate radiant and glowing blemish free skin. Honey is a natural antioxidant that improves skin tone and prevents cell damages. Honey is also known to have some antimicrobial properties",Beauty & Hygiene,65
758,Murvyn Shearme,"69 Butternut Drive",1991-07-27,tkingabyl2@google.fr,758,HandMade Men Black Checked Bomber Jacket,"Black checked jacket, has a stand collar, 3 pockets, zip closure, long sleeves, straight hem, and polyester",clothes,217
759,Robbin Corfield,"933 Ridgeview Hill",2003-07-29,nbrennansl3@yelp.com,759,Glow Vanilla Lavender Body Polisher,"The aromatic gel of pure herbs and essential oils for daily body cleansing in the shower uses exfoliating fine crystals which polish the skin, leaving it incredibly smooth & buffed. Lavender and honey are the powerhouses for providing a radiant and flawless complexion.",Beauty & Hygiene,247
760,Cristi Woolforde,"8 Green Crossing",1992-06-24,dbailliel4@studiopress.com,760,HandMade Women Maroon Regular Fit Printed Casual Shirt,"Maroon printed casual shirt, has a spread collar, short sleeves, button placket, and curved hem",clothes,273
761,Lonnie Prince,"46038 Haas Pass",1998-08-13,ewickinsl5@w3.org,761,"Pure Tea Tree Glycerin Soap - Cold-Processed, 100% Natural & Organic","Tea Tree Oil is regarded as one of the strongest natural antiseptics known to man. Because of its ability to inhibit and kill the growth of bacteria, fungi & germs, it makes a great medicinal soap for cuts & scrapes as well as a multi-purpose antibacterial and facial soap for everyday use. All you smell is the invigorating, minty smell of tea tree oil. Glycerin has humectants properties, attracting moisture to your skin making it softer & smoother, one of the reasons that our soaps are so beautiful on the skin. This soap does not use any animal product like milk or honey i. e. it is completely vegan and is SLS free.",Beauty & Hygiene,278
762,Sibyl Josefowicz,"46772 Paget Avenue",2002-02-22,lkeenorl6@telegraph.co.uk,762,HandMade Men White Solid Polo Collar T-shirt,"White solid T-shirt, has a polo collar, and short sleeves",clothes,128
779,Lillis Hurworth,"26832 Esch Point",1992-08-15,pelmesln@bbb.org,779,Remedies Ketobus - Z Soap,"HandMade Ketobus Z Soap is an Anti-Dandruff and Anti Fungal soap. It helps to relieve the flaking, scaling, and itching associated with dandruff. Ketoconazole is an azole antifungal that works by preventing the growth of fungus on the scalp. It protects the scalp from infections and makes your hair healthy and strong. Reduces dandruff and dryness of scalp. Has anti-fungal and anti-bacterial properties. Moisturizes scalp and prevents flakiness.",Beauty & Hygiene,21
763,Ricki Durkin,"2 Butternut Drive",1991-04-26,prantoull7@slideshare.net,763,"Pure Orange Glycerin Soap With Coconut Oil - Cold Processed, 100% Natural & Organic","Every day your skin comes in contact with dirt, pollution, wind, sun and sweat. In spite of these setbacks, you can still have the softest, gentlest skin. Natural nutrients gently and effectively lighten dark spots for a more youthful and even-toned radiant skin. The rich lather rinses completely leaving no residue, while orange peel powder deep cleanses to remove dirt, bacteria, and oil and exfoliates dead skin cells for blemish-free dear skin, Works wonders on troubled teenage and oily skin. Glycerine has humectants properties, attracting moisture to your skin making it softer and smoother, one of the reasons that these soaps are so beautiful on the skin. This soap does not use any animal product like milk or honey. This product is SLS free.",Beauty & Hygiene,246
764,Leonardo Bockler,"928 Iowa Center",1993-03-18,aelstonel8@nsw.gov.au,764,HandMade Women Rust Red Solid Bardot Top,"Rust red solid woven bardot top, has an off-shoulder neck, and three-quarter sleeves",clothes,290
765,Cchaddie Josey,"64210 Forster Court",2001-07-16,nboughl9@redcross.org,765,Himalayan Pink Bath Salt,"Himalayan pink salt is mined in the Khewra Salt Mines, the second largest salt mine in the world, located in Khewra, Punjab, Pakistan, about 300 km from the Himalayas. Himalayan Pink Salt is a pure, hand-mined salt that is derived from ancient sea salt deposits, and it is believed to be the purest form of salt available. The high mineral crystals range in colour from sheer white, varying shades of pink, to deep reds, the result of high mineral and iron content. HandMade Himalayan Pink Salt is the best way to take care of your skin during your bath. Himalayan Pink Salts contain more than 84 minerals and trace elements like calcium, copper, magnesium, potassium and iron that are all good for your skin and body. Regular use of Himalayan pink salt provides proper nutrient absorption, eliminates toxins, normalizes blood pressure, increases circulation, assists with relief from arthritis, skin rashes, flu and fever symptoms.",Beauty & Hygiene,102
766,Terencio Eccott,"2 Truax Court",1996-10-01,wrzehorla@bluehost.com,766,HandMade Men White Regular Fit Self Design Formal Shirt,"White self-design formal shirt, has a spread collar, long sleeves, button placket,  straight hem, one patch pocket",clothes,82
767,Ashly Blundon,"73 Ridgeview Alley",1990-11-28,bwardroperlb@indiatimes.com,767,Sandal Saffron Bath Salt,"HandMade Natural Handmade Bath Salts have been developed to mimic the properties of natural mineral baths or hot springs. The best way to refresh you after a long tiring day is to soak yourself in them. So simply allow the salts to swirl around gently as you take a deep breath, lie back and unwind in your own personal bath. Simply adding the bath salt to your bath water has several benefits.Tip: Following a regular skin care regime can help you achieve flawless skin. For more tips on skin care, visit bigbasket lifestyle blog, ",Beauty & Hygiene,71
768,Heather Gidley,"6342 Florence Road",1997-03-23,nvowleslc@dell.com,768,HandMade Women Pink Solid Bomber Jacket,"Pink solid jacket, has a stand collar, 2 pockets, zip closure, long sleeves, straight hem, and polyester lining",clothes,97
769,Lambert Haack,"005 Fallview Road",1998-10-25,clearmonthld@t-online.de,769,"Loofah/Sponge Scrubber/Body Bath  - Hangable, Grey, BH-005 GRY","Have a refreshing bath experience with this loofah. It improves the circulation of your skin and eliminates the dead skin cells. The loofah sponge is composed of plastic mesh fibres that exfoliate the skin, resulting in the smooth and glowing skin.",Beauty & Hygiene,292
770,Dominic Smorthit,"8901 Beilfuss Trail",1998-03-30,icritophle@nytimes.com,770,HandMade Men Pink Slim Fit Self Design Formal Shirt,"Pink self-design formal shirt, has a spread collar, long sleeves, button placket,  straight hem, one patch pocket",clothes,203
771,Welch Fortune,"5 Dakota Street",1991-03-11,mspeechlylf@flavors.me,771,Shower Gel - Green Tea,"Calm Restor Refresh Made in Malaysia. Content - 1000ml. This exfoliating scrub gently removes dead skin and will leave your body feeling soft and smooth. Delicately scented with a fragrance of Green Tea.  For Beauty tips, tricks & more visit https://bigbasket.blog/",Beauty & Hygiene,116
772,Ripley Sherrin,"1 Melrose Court",1994-01-14,sodelllg@usnews.com,772,HandMade Men Grey Regular Fit Solid Formal Trousers,"Grey solid mid-rise trousers, button closure, and 4 pocketsDisclaimer: The stylist has paired this pair of trousers with a belt. This pair of trousers does not come with a belt.",clothes,284
773,Zarah Tourmell,"330 Hovde Drive",1993-08-08,swinkettlh@google.cn,773,Bathing Bar - Watermelon & Cucumber,"Watermelon & Cucumber-a scent inspired by cucumbers on the vine, a garden after a morning rain, freshly cut watermelon that smells crisp and green and is slightly sweet with the added goodness of Aloe Vera. Make bath time more luxurious with our artisan range of handcrafted 50 AP bathing bars.For Beauty tips, tricks & more visitÂ https://bigbasket.blog/",Beauty & Hygiene,94
774,Yale McKune,"856 Pierstorff Plaza",1990-02-27,cbarnwellli@cafepress.com,774,HandMade Girls Mustard Yellow & Red Solid Top with Trousers,"This clothing set consists of top and trousersMustard yellow self-design top, has a round neck, sleevelessRed solid trousers, has a slip-on closure",clothes,292
775,Ranice Wordsworth,"60285 Reindahl Point",1998-04-08,basplj@samsung.com,775,Nomarks - Antimarks Soap For Oily Skin,"New HandMade nomarks soap helps remove excess oil, deep-rooted dirt and provides relief from sunburn, blemishes and acne or pimple problems. It is a natural antiseptic which provides deep pore cleansing. Its key ingredient neem is a miraculous herb which is medicinal in nature and has potent antibacterial and powerful healing properties. Neem effectively prevents and treats itching, rashes, acne and other skin ailments.",Beauty & Hygiene,166
776,Melisenda Willox,"1 Eastlawn Hill",1998-03-22,grushsorthlk@devhub.com,776,HandMade Men Blue Slim Fit Self Design Formal Shirt,"Blue self-design formal shirt, has a spread collar, long sleeves, button placket,  straight hem, one patch pocket",clothes,106
777,Betteanne Carus,"44 Maple Place",2000-10-14,npiollill@ezinearticles.com,777,Pure Mint Soap,Mint soap is a powerful skin friendly herb which has antiseptic effects. Peppermint incorporated in mild excessive soap base take out heat from the skin while keeping it cool even after a refreshing shower.,Beauty & Hygiene,235
778,Ram Ireson,"81 Mcguire Road",2002-03-19,bandreelm@yahoo.co.jp,778,HandMade Men Blue Slim Fit Solid Formal Shirt,"Blue solid formal shirt, has a spread collar, long sleeves, button placket, straight hem, and 1 patch pocket",clothes,74
780,Car Lockton,"23 Forest Run Hill",1998-09-14,aproudlo@stumbleupon.com,780,HandMade Men Navy Blue Woven Design Sneakers,"A pair of round-toe navy blue & grey sneakers, has regular styling, lace-up detailTextile upper with woven design detailCushioned footbedTextured and patterned outsoleWarranty: 6 monthsWarranty provided by brand/manufacturerEngineered with waterproof lining",clothes,186
781,Shelby Corking,"2516 Autumn Leaf Crossing",2003-07-21,wcarlolp@taobao.com,781,Volumising Brush Small (HC-05),"Professional heat activated shaker and multi styler brushes feature aluminum heads which retain heat, cut blow-drying time and set styles for longer.  For Beauty tips, tricks & more visitÃ‚ https://bigbasket.blog/",Beauty & Hygiene,127
782,Maryjo Solon,"0034 Blackbird Road",1996-07-31,csunnerlq@google.nl,782,HandMade Men Charcoal Solid Regular-Fit Single-Breasted Blazer,"Charcoal grey solid slim-fit blazer, has a notched lapel, single-breasted with double button closures, long sleeves, three pockets, an attached lining and a double vented back hem",clothes,246
783,Pace Samber,"3228 Mariners Cove Center",2000-06-06,hamislr@about.me,783,Lavender Essentials Gift Set,"The products range in our gift set are formulated by combining precious essential oils with the blend of natural and organic ingredients. The idea behind the whole creation is to provide you and your dear ones the natural skin care products which are healthy, regenerating and maintain body and skin balance.The blue box with a beautiful blue ribbon contains:Lavender Shower Gel With Skin Conditioners - 200 mlLavender Skin Toner - 100 mlNatural Lavender And Vanilla Body Massage Oil - 100 mlWooden Massager - 1 pcBath Puff - 1 pcAromatic T-light Candles - 2 pcs",Beauty & Hygiene,108
784,Georas Fanti,"5402 Esker Park",1991-10-06,tdarnbrookls@squarespace.com,784,HandMade Literide  Men Black Woven Design Sneakers,"A pair of round-toe black sneakers, has regular styling, lace-up detailMesh upperCushioned footbedTextured and patterned outsoleWarranty: 3 monthsWarranty provided by brand/manufacturer",clothes,66
785,Julina Mackro,"53 Merry Drive",2000-06-27,wmacgownlt@state.gov,785,Strawberry Essentials Gift Set,"The products range in our gift set are formulated by combining precious essential oils with the blend of natural and organic ingredients. The idea behind the whole creation is to provide you and your dear ones the natural skin care products which are healthy, regenerating and maintain body and skin balance.The red box with a beautiful red ribbon contains:Strawberry Shower Gel With Skin Conditioners - 200 ml1-Minute Manicure Hand Scrub (100% Natural) - 100 gmHeart-shaped Strawberry Bathing Bar - 100 gm2-in-1 Pumice & Brush - 1 pcWooden Massager- 1 pcBath Puff - 1 pcAromatic T-light Candles - 2 pcs",Beauty & Hygiene,198
786,Pyotr Mallaby,"43 Bultman Avenue",1990-12-09,gcolebrooklu@businesswire.com,786,HandMade Men Blue Slim Fit Solid Casual Shirt,"Blue solid casual shirt, has a spread collar, long sleeves, button placket, and curved hem",clothes,176
787,Maggi Toderi,"896 Rigney Circle",1998-01-22,gburgeslv@gov.uk,787,Pink Grapefruit & Vitamin C Luxury Shower Gel,"St Botanica Pink Grapefruit & Vitamin C Body Wash is a balanced blend of luxurious cleansers and essential oils. Designed for men and women to be used as a body wash, shower gel, or bubble bath. This clinical-grade formula is safe for all skin types and even sensitive skin. Soap-Free and Free from Paraben. St Botanica Pink Grapefruit & Vitamin C Body Wash showers you with the clean, fresh scent of pink grapefruit and vitamin c essential oils, along with skin-conditioning, leaving your skin feeling fresh and delightfully fragrant. St Botanica products offer great quality beauty solutions for the entire family to help you look good, smell good and feel good every day. A unique, high-quality product based on the best, natural, active plant-based ingredients for skin care - created according to timeless Thai spa and healing formulas designed to nourish and heal your skin and senses.",Beauty & Hygiene,110
788,Caresa Hubatsch,"516 Grasskamp Alley",1995-01-25,alyonlw@goo.ne.jp,788,HandMade Men Multicoloured Striped Polo Collar T-shirt,"Multicoloured striped T-shirt, has a polo collar, and short sleeves",clothes,178
789,Nikolos Benford,"9 Buell Court",1996-08-23,mbarrarlx@engadget.com,789,Ocean Blue Aroma Bath Salt for Acne Control - Dry Skin & Body Detox,"Our mineral-rich sea salt is mined from the Indian Ocean. This natural bath salt draws out impurities from your body, revitalizes skin, eliminates dryness and improves skin texture.",Beauty & Hygiene,70
790,Sylvester Kenworthy,"0 Independence Circle",2002-07-26,dpigginsly@vkontakte.ru,790,HandMade 04 Eiko Minimalist Whipped Powder Blush 5 g,"Shade No: 04Shade Name: EikoWhat it isThis air-whipped cream blush transforms into a long-lasting, weightless, breathable powder with a soft matte finishWhat it doesThis blush uses breakthrough AirFusion Technology to blend effortlessly across skin. The mousse-like texture transforms into an ultra-thin, featherweight powder with a soft matte finish that lasts eight hours. Available in six vivid shades inspired by the House of HandMade's muses and collaborators of the past and present.",clothes,82
791,Kincaid Greschik,"56 Forest Run Avenue",2000-06-23,szannotellilz@de.vu,791,Cold Processed Hot Chocolate Handmade Soap,"100% pure, natural, vegan and cold-pressed HandMade Hot Chocolate Soap is a handmade, hand-cut, natural oil-based soap. It is made from Chocolate, Cocoa Powder and Cocoa Butter, Coconut milk, oils of Olive, Coconut, Castor and Palm with Vitamin E. Chocolate reduces tan and makes your skin glow while Coconut milk deeply moisturizes your skin. While our exquisite blend of essential oils prevents damage to give you healthy skin. Sensationalize your senses with the lush aroma of our exquisitely blended soap formulation that gives a creamy luxurious lather.",Beauty & Hygiene,122
792,Albert MacTavish,"60 Old Shore Alley",1996-06-21,mblawm0@bbb.org,792,HandMade Brown Wooden Handcrafted Sheesham Wood Owl Block Cutlery Holder,"Type: Cutlery and toothpick holderColour: BrownPattern: OwlFEATURES:- Ideal for storing day-to-day dining cutlery like spoons, forks, etc.- Can also be used as utility container or knick-knacks holder to organize your work desk and can also be used to keep stationery items.- Comes with 3 partitions to store cutlery, napkins & toothpicks separately.- The owl block is hand engraved in sheesham wood attached to the holder.- Made in Sheesham Wood.- The product has been made by hand and may have slight irregularities that are a natural outcome of the human involvement in the process.",clothes,236
793,Randie Bereford,"894 Lukken Center",1997-03-06,jaitonm1@pen.io,793,Almond Oil Scrub Natural Handmade Herbal Soap,"Have your baby skin back with Almond Oil Scrub Natural Handmade Herbal Soap from HandMade. Almond oil is a rich source of Vitamins A, B, and E which are great for your skin health. It is really mild on your skin and suits all skin types. It helps in maintaining the moisture levels of your skin and gets absorbed in a jiffy without blocking your pores which we all know is one of the most common reasons behind a number of skin problems. Almond oil is not only a good moisturiser but also works as a great ingredient in scrubs which can help you to get rid of impurities and dead skin. It is also ideal makeup remover for all skin types.",Beauty & Hygiene,19
794,Hallie Norrey,"88256 Schiller Court",2004-02-10,tronchim2@harvard.edu,794,HandMade Women Off-White Solid Leather Open Toe Flats,"A pair of off-white solid leather open-toed flats, has regular styling, buckle detailLeather upperCushioned footbedTextured and patterned outsole",clothes,259
795,Debbie McIlwreath,"90 Straubel Trail",1996-10-08,sknevetm3@samsung.com,795,"Sea Cool Glycerin Soap - Cold Processed, 100% Natural & Organic","Our Sea Cool Glycerin Soap is 100% veg soap, made from natural herbs, essential oils & vegetable oils. Glycerin, which is produced naturally during the soap making process moisturizes the skin. These natural ingredients make our soap bubbly, creamy & soft. Feel refreshed with the amazing aroma of the salty sea.Be on the beach every day! Glycerin has humectants properties, attracting moisture to your skin making it softer & smoother, one of the reasons that our soaps are so beautiful on the skin. This soap does not use any animal product like milk or honey. This product is vegan and is SLS free.",Beauty & Hygiene,98
796,Rozanne Van Halle,"61821 Forest Place",1991-11-22,cnottm4@google.ru,796,HandMade Green & Orange Printed Table Runner,Set content: One runner Type: Table runner Colour: Green and orange Fabric: Polycotton Shape: Rectangular Pattern: Printed Disclaimer : Product colour may slightly vary due to photographic lighting sources or your monitor settings.,clothes,247
797,Chip Thairs,"6883 Stang Trail",1996-03-01,mrobem5@icq.com,797,Detox Charcoal Shower Gel,"This Charcoal detox shower gel is an organic, sulphate-free and mild and deeply purifying formulation enriched with:Charcoal - that is proven to absorb multiple times its own weight in harmful substances like toxins, impurities, bacteria and dirt and helps to fight acne, Black Sand Phytpeel - that deeply exfoliates the skin, Anise - that heals, soothes and adds glow to the skinBasil - that prevents skin infections and rejuvenates the skinLemon - that acts as an antiseptic and astringentNeem - that has anti-bacterial properties for clearer skin and Peppermint - that has a cooling and calming effect on the skin. It reduces sebum and fights off acne producing bacteria and leaves you feeling refreshed and invigorated. It can be used on both face and body.",Beauty & Hygiene,63
798,Grady Spring,"5464 Northridge Hill",1995-03-01,vsilcocksm6@fema.gov,798,HandMade Men Red Mesh Running Shoes,"A pair of red running sports shoes, has regular styling, lace-up detailMesh upperCushioned footbedTextured and patterned outsole",clothes,261
799,Opal Fripps,"24121 Petterle Court",1993-02-11,lhaslehurstm7@aol.com,799,Rose & Jasmine Handmade Luxury Soap,"Enjoy a relaxing bath with our handcrafted soap. Rose and jasmine essential oils are blended to produce a sensuous fragrance that instantly invigorates. The essential oils mingle with premium moisturizing carrier oil to provide superior skin care. Your skin is nourished with fatty acids, vitamins and antioxidants as you cleanse.Flower Power: HandMade soap enriched with floral essential oils and real flower will transform your bathroom into a garden. Your body and mind will be enlivened by rose, jasmine and rhododendron. We have incorporated these amazing flowers and their essential oils into our soap so that your skin is rejuvenated by their antimicrobial, antioxidant and anti-inflammatory properties. They soothe the skin, thwart activities of free radicals, maintain oil balance and enhance your skin tone.Intense Hydration: Unlike soaps with harsh chemicals, saponified organic extra virgin olive oil as the soap base cleans without drying out the skin. The moisture barrier of the skin is fortified with cold-pressed sesame oil, castor oil and virgin coconut oil. Sesame oil is rich in anti-inflammatory compounds. It gives the skin a healthy glow. Castor oil is an excellent cleanser. It dissolves impurities and boosts skin health.Virgin coconut oil is a source of amazing fats that nourish the skin and lock moisture. Mahua oil is one of the best-kept beauty secrets of India. The antioxidant rich oil is an amazing emollient. Kaolin Clay: Owing to the presence of kaolin clay, the intense moisturizing soap will not leave the skin feeling greasy. Kaolin clay absorbs the excess oil and controls the oil balance of the skin. Your skin will feel soft and hydrated for a long time.Healthy Skin Naturally: When your skin receives nourishment when you cleanse it, it will retain its healthy youthful lustre. The dull dry skin is instantly rejuvenated by using this soap. The damaged skin receives nourishment and heals rapidly. Our soap gives your skin everything it needs to stay healthy. Luxurious natural handcrafted soap with invigorating floral fragrance. Made with the finest ingredients available in nature.",Beauty & Hygiene,216
800,Cris Hallibone,"6 Prairie Rose Hill",1992-04-27,fpudgem8@i2i.jp,800,HandMade Women Orange Solid Round Neck T-shirt,"Orange solid T-shirt, has a round neck, and short sleeves",clothes,286
801,Nesta Hegley,"99 Walton Junction",1994-07-20,bholtawaym9@amazon.co.jp,801,"Soap Pocket - Foamy, Bath Essentials","HandMade Bath Essentials Foamy Soap Pocket is here to bring back the Joy of Bathing!Put your soap in this delicately sewn pocket, it is the new trend. It will make your soap lather four times as much and be of use till the very end.",Beauty & Hygiene,106
802,Legra Blacksland,"077 Helena Center",1995-10-19,dwollandma@gizmodo.com,802,HandMade Grey Solid Shoulder Bag,"Grey solid shoulder bag, has a zip closure1 main compartment, 2 external and 2 inner pocketsTablet sleeve: YesTwo Handles with detachable sling strapWarranty: 3 yearsWarranty provided by brand/manufacturer",clothes,81
